interest_id,customer_id,survey_date,interest_level,comments
1,1,2023-12-21,high,Film former subject source.
2,2,2023-12-24,high,Themselves agency southern physical anything score.
3,3,2024-11-23,high,Everyone article whether.
4,4,2023-06-18,low,Important movie unit place.
5,5,2023-07-18,low,Far receive little none enough.
6,6,2025-04-16,medium,Party stop art remain enough light.
7,7,2024-04-09,low,Rest education stage stand.
8,8,2024-05-19,high,Box school low.
9,9,2025-03-27,medium,Result price ground station some forget.
10,10,2023-07-02,high,Me record experience area.
11,11,2024-08-25,high,Claim chair class perhaps give.
12,12,2024-01-07,high,Pay can assume bank pressure tonight.
13,13,2023-05-21,high,Knowledge record finally nothing southern fall pick.
14,14,2024-07-07,high,Prove before authority whatever partner according culture cut.
15,15,2023-07-10,medium,Drive deal affect area phone.
16,16,2023-10-23,high,Pull six back little girl spend front.
17,17,2024-12-03,high,Behavior guy year you.
18,18,2024-10-15,low,Foreign group contain modern.
19,19,2023-09-24,high,Nearly list everybody year high.
20,20,2024-09-30,high,Water game lay able soon before.
21,21,2024-01-07,low,Choice its kid manager cover break.
22,22,2024-05-27,low,Natural offer member oil realize.
23,23,2024-03-28,low,Thing actually wish effect.
24,24,2024-04-27,high,Ask environmental bed poor.
25,25,2024-08-29,high,Official break director perhaps feeling remain offer.
26,26,2024-11-23,high,Sing become dark song rock amount full.
27,27,2023-06-12,high,Piece stage none concern detail do challenge.
28,28,2024-02-02,low,Money focus full class girl continue office.
29,29,2023-05-23,high,Avoid idea sometimes director.
30,30,2024-04-07,low,Economy hair put glass practice near ask.
31,31,2024-02-18,high,Toward thing cultural better miss.
32,32,2025-04-19,low,Pay talk partner picture.
33,33,2025-01-18,low,Range country test.
34,34,2024-04-06,high,Could dinner I rise reflect bring want.
35,35,2025-01-02,low,Rise across line bar yeah four.
36,36,2023-06-03,low,Nature himself might price.
37,37,2023-06-30,high,Answer decision reveal discover play campaign add.
38,38,2024-04-19,medium,Then son return.
39,39,2023-10-13,medium,Letter question later leave.
40,40,2023-11-17,medium,Soon believe use create assume will fire.
41,41,2023-10-24,high,Even finish view.
42,42,2023-08-22,high,Size type point pay rise toward.
43,43,2024-08-06,high,Likely east group worry product.
44,44,2023-05-08,high,Various air floor Democrat none.
45,45,2024-05-06,medium,Experience growth eye.
46,46,2024-08-09,low,Hit chance family yourself yourself small.
47,47,2025-01-06,low,Enough let step.
48,48,2025-02-08,medium,North card keep nearly eat society music.
49,49,2023-09-26,medium,Action need push week.
50,50,2024-08-29,high,Care TV media.
51,51,2023-08-30,high,Be style season top oil.
52,52,2023-05-31,high,Suggest reduce town seat attorney travel house.
53,53,2023-05-13,high,Individual somebody small special.
54,54,2023-09-02,high,Cut perhaps capital anything.
55,55,2025-02-27,low,Drive future trouble issue my wall town.
56,56,2023-06-29,high,Way speak campaign because especially audience relationship.
57,57,2023-08-02,low,Situation be quickly someone evening can.
58,58,2023-07-07,high,Even through coach security fire example sport.
59,59,2024-09-16,medium,Loss although defense mention possible such religious official.
60,60,2023-12-11,high,Probably certain fine either environmental majority those.
61,61,2023-07-14,high,Throughout page score dog hear.
62,62,2024-10-21,low,Identify movement reality training reflect claim grow successful.
63,63,2023-05-09,low,Participant although try own.
64,64,2023-08-16,high,Professional necessary quickly stuff design manager into.
65,65,2023-08-12,low,Official feel nature cell enjoy skill hospital.
66,66,2024-02-25,high,Dog look pretty office first radio trouble.
67,67,2025-03-14,medium,Answer message American check water should voice.
68,68,2023-12-16,low,Yeah size health five herself.
69,69,2024-11-19,high,Record cold maintain include energy hope keep.
70,70,2023-05-11,medium,Deep husband easy whose ok music develop result.
71,71,2024-12-21,medium,Newspaper least those way because simple condition.
72,72,2024-05-08,medium,Live strong tonight understand car.
73,73,2023-05-11,high,Push seven reduce visit Mrs program way.
74,74,2025-01-15,high,Speech admit station customer power.
75,75,2024-06-26,high,Meeting entire single meeting candidate protect.
76,76,2024-06-04,high,Gun summer tell lose join.
77,77,2024-12-26,low,Million sit among husband.
78,78,2024-10-25,low,Begin short nature.
79,79,2023-09-26,low,High anything activity increase democratic live once.
80,80,2024-05-22,high,Again may ask apply candidate whole.
81,81,2024-06-18,medium,Move within ability.
82,82,2023-10-18,high,Oil common medical world security.
83,83,2024-06-28,low,Air bar eight that.
84,84,2023-11-07,low,Pressure personal on use short but accept.
85,85,2023-09-16,medium,College wait list station upon loss.
86,86,2024-11-13,low,Prove political true reason face gas need.
87,87,2023-10-13,low,Indicate each behind figure million item spend.
88,88,2024-09-10,medium,Way little quite behind expert purpose him.
89,89,2025-01-04,high,Relationship north event language century tough include head.
90,90,2024-07-25,medium,Involve realize step market body.
91,91,2025-04-15,low,Describe professor draw.
92,92,2023-09-06,high,Try above ask anything.
93,93,2024-12-09,high,They local require.
94,94,2025-01-14,low,So others member material.
95,95,2023-08-02,medium,Offer know with likely common child without.
96,96,2024-02-06,low,Including measure audience open federal ten.
97,97,2023-11-12,medium,Hope company stay.
98,98,2024-08-22,low,Education find feeling pull think prepare that.
99,99,2023-12-02,medium,Image middle defense coach why.
100,100,2024-04-12,high,Space nothing under off.
101,101,2024-09-15,medium,Stock prevent seem show something yeah himself.
102,102,2024-09-21,low,Baby rock company nice matter.
103,103,2023-06-14,medium,Show technology choose research middle dog.
104,104,2024-09-26,low,Race compare much standard before only.
105,105,2023-11-26,high,However occur like pull.
106,106,2023-09-10,medium,Really kitchen himself white street use subject.
107,107,2024-04-25,low,Far show while ten owner notice.
108,108,2024-10-22,medium,Former color organization rock language child pass well.
109,109,2023-11-16,low,As affect why usually cut table.
110,110,2024-02-23,high,Almost whose check report.
111,111,2023-11-06,low,Something must cultural here.
112,112,2024-12-31,medium,Often policy describe gas.
113,113,2025-04-14,high,Seem decade like recognize.
114,114,2024-12-02,low,Want property arm economy enjoy.
115,115,2023-06-03,medium,Century some work prepare.
116,116,2023-11-03,medium,Herself collection city music wall strategy beat.
117,117,2024-04-27,high,Over real mission maybe pull.
118,118,2024-09-06,low,Thousand great authority determine.
119,119,2024-11-11,high,Form I sing add say.
120,120,2024-05-18,low,Perform campaign interesting most doctor prove.
121,121,2024-08-14,high,School traditional such sister performance cut.
122,122,2024-05-28,medium,Analysis state hope yard lead his training.
123,123,2023-08-25,medium,Glass rate executive art spring to trial.
124,124,2024-12-17,high,Structure strategy pretty involve onto and laugh.
125,125,2024-06-07,low,Surface be drive us perform education argue apply.
126,126,2023-11-06,high,News know finally letter design way.
127,127,2024-08-30,low,Movie thing me side start.
128,128,2025-03-30,low,After shake month never but.
129,129,2023-07-23,high,Mrs with base policy gun.
130,130,2024-01-16,low,Across mention hour method scene despite.
131,131,2023-05-12,high,Despite ball enter alone center.
132,132,2023-07-24,medium,Mention budget community officer build individual.
133,133,2024-09-09,medium,Nor always room picture point father.
134,134,2025-02-15,high,Be ready pretty man born.
135,135,2024-03-14,low,Front one forward value development.
136,136,2024-12-16,medium,School free argue game else design training.
137,137,2024-10-22,high,Type sit rule.
138,138,2025-01-24,low,Nearly realize sing.
139,139,2024-10-04,high,Ask conference reflect war owner.
140,140,2025-03-25,high,Break government better firm loss white he.
141,141,2023-10-16,low,Night clear fast speech relate share seek.
142,142,2024-07-23,low,Day before trip heavy power better.
143,143,2023-09-10,low,Total no project bag film family poor.
144,144,2024-11-03,low,Behavior start vote machine value always.
145,145,2023-06-29,medium,Color range stage story size air view.
146,146,2023-08-04,low,Ready structure thank rich care.
147,147,2024-11-09,medium,Cost I most produce choose compare modern.
148,148,2024-10-06,high,Get strategy side security.
149,149,2025-01-30,low,Least federal group significant remember.
150,150,2024-06-12,low,Himself produce product late you miss.
151,151,2023-08-17,high,Mission artist focus these message view image area.
152,152,2024-07-10,medium,Eight leg support side.
153,153,2023-05-19,low,Language spend market recently.
154,154,2024-01-16,low,Throughout travel fine chance different color everyone security.
155,155,2024-01-20,high,Majority indeed eye summer their.
156,156,2024-07-06,low,Customer scene let floor already.
157,157,2025-03-23,high,President instead senior company then carry.
158,158,2024-06-16,high,What our job ever maybe human body.
159,159,2024-09-17,medium,Address under west want.
160,160,2023-12-18,high,Reality in cover law surface nature there.
161,161,2024-07-25,high,Reduce start impact against next.
162,162,2024-05-15,low,Between sell laugh itself at list camera.
163,163,2023-10-31,low,Including shoulder do analysis such few rather.
164,164,2024-03-08,low,Report up red sport.
165,165,2023-07-17,medium,Big project red boy economic allow.
166,166,2024-03-03,low,Fly hit collection rise performance player future.
167,167,2024-06-12,high,Almost statement worry owner follow exist.
168,168,2024-01-26,high,Defense most agreement picture item positive.
169,169,2023-08-23,medium,Boy body note necessary drug account wait consider.
170,170,2023-09-17,medium,Popular manager girl crime upon.
171,171,2025-02-21,high,Seat back fire his information wish.
172,172,2024-08-17,high,Impact who father from just blue firm.
173,173,2023-12-10,low,Floor institution ten range.
174,174,2023-06-29,high,Lawyer use together pattern forget center.
175,175,2024-05-09,medium,Should order body former reduce exist past.
176,176,2023-06-22,high,Walk option week son country receive doctor.
177,177,2024-08-15,high,Scene write six window born citizen this.
178,178,2024-07-18,medium,Model even collection parent general.
179,179,2024-02-17,low,Mean remain hear yeah dinner interesting.
180,180,2024-07-09,high,Over million civil man.
181,181,2023-07-16,medium,Current save defense story health team property.
182,182,2025-03-31,low,Very near argue soon.
183,183,2025-01-08,medium,Difference recognize speech direction although science.
184,184,2024-03-08,high,Without decade including the.
185,185,2024-02-27,high,Begin research put also tree.
186,186,2025-01-04,high,Born itself image most.
187,187,2025-04-22,medium,Open conference late indicate.
188,188,2024-11-30,medium,Nice attention item type.
189,189,2024-12-11,low,History education care least.
190,190,2023-06-24,medium,Attorney kind day fund model us.
191,191,2024-04-25,high,Result usually doctor tend idea.
192,192,2023-09-01,high,Last himself eye thus.
193,193,2024-09-18,low,Beautiful American right pull.
194,194,2023-12-22,high,Able pass development best.
195,195,2023-11-17,low,Too research large maintain must lawyer.
196,196,2024-05-27,medium,Six here dog act yes together.
197,197,2023-06-04,low,Social modern his road.
198,198,2023-12-15,low,Ten way financial scene course defense.
199,199,2023-05-19,low,Total born action owner.
200,200,2023-08-08,medium,Everyone PM challenge hot prepare argue already.
201,201,2025-03-19,low,Number quite mother issue.
202,202,2023-09-05,high,Successful condition down politics.
203,203,2023-06-18,low,Require factor all.
204,204,2024-06-26,high,School focus ability across huge.
205,205,2025-02-02,medium,Score cost shake player.
206,206,2023-09-05,high,Center show bank.
207,207,2023-08-25,low,Father reflect we out position training against election.
208,208,2023-09-03,medium,Us discover son side explain talk.
209,209,2024-03-25,high,Law available campaign here.
210,210,2025-03-23,medium,Sort pretty far example it rate shake.
211,211,2023-12-07,high,Recent opportunity number yes rest white talk.
212,212,2024-01-15,low,Agree of western year lawyer shake.
213,213,2023-10-24,high,Free anyone performance but respond.
214,214,2025-02-08,high,Deep color act through.
215,215,2025-04-10,medium,Window feel individual company west challenge.
216,216,2024-07-22,medium,Type last matter prepare street develop.
217,217,2024-09-23,medium,Company might their red word together.
218,218,2024-03-18,low,Daughter budget chair understand.
219,219,2023-11-18,high,Require improve letter imagine right everything although.
220,220,2025-04-02,medium,Civil suffer control indicate.
221,221,2023-09-15,medium,Seat base note eight also challenge assume.
222,222,2023-07-26,low,Detail sometimes little subject road.
223,223,2025-03-28,low,Break available pressure because.
224,224,2024-02-27,high,Another sea city.
225,225,2023-08-03,low,By beautiful possible agent detail go.
226,226,2024-08-11,high,Watch rest civil item.
227,227,2024-08-19,low,Million agree sea always staff financial PM.
228,228,2023-05-19,low,Cover through TV purpose tree Mrs effort.
229,229,2023-06-15,high,Whatever case training career.
230,230,2024-05-19,medium,Lay direction only whatever.
231,231,2023-09-23,medium,Whose gun economy long indicate defense.
232,232,2023-11-09,low,Expect order hear want fire Congress.
233,233,2024-07-06,high,Strong poor return laugh be prevent left.
234,234,2024-02-04,low,Different lead message method.
235,235,2025-03-01,low,Pay most himself find.
236,236,2024-12-19,medium,Middle kind center against market happy arrive.
237,237,2024-02-26,low,Various occur might Republican all reduce.
238,238,2024-11-04,low,Begin close positive where international animal happen third.
239,239,2024-07-07,low,Whom central benefit perform hard yard improve.
240,240,2023-04-27,medium,Space dog some heart record rich court friend.
241,241,2023-11-02,low,Future but baby general.
242,242,2025-01-29,high,Affect another threat shoulder.
243,243,2024-05-03,low,Official scene sign family perhaps.
244,244,2024-02-19,low,Wonder kind industry inside hundred.
245,245,2024-11-28,high,Focus get next show three type.
246,246,2024-12-21,low,It eight fund enough town this.
247,247,2023-07-24,high,Interview force left.
248,248,2024-07-22,medium,Result hand night.
249,249,2024-05-21,low,Institution make despite traditional serious energy me.
250,250,2024-08-22,medium,Practice early have pretty pick down.
251,251,2023-05-09,medium,Teach month smile white sure chair method.
252,252,2023-10-10,low,Nothing least prove live.
253,253,2024-05-14,low,High American whole by pull moment.
254,254,2024-07-02,medium,Old movie against responsibility eye design several.
255,255,2023-11-16,low,Film drug act perform political poor.
256,256,2025-04-10,medium,Institution nature memory herself.
257,257,2024-07-25,medium,Near several knowledge development pretty late.
258,258,2025-04-01,low,Forget memory policy want.
259,259,2024-06-18,medium,Box billion until common every.
260,260,2024-10-24,medium,Point here ask type good.
261,261,2024-06-15,medium,Share anyone fine event social.
262,262,2023-10-20,low,Street a past if national student they.
263,263,2023-11-04,medium,Soon hotel table begin sound positive director.
264,264,2023-12-13,low,Film news at blood buy easy.
265,265,2024-03-23,low,Tree white serious still both fund different.
266,266,2025-04-24,high,Wall population pass seven.
267,267,2024-12-25,medium,Relate pressure room administration call.
268,268,2025-01-27,high,Several identify smile.
269,269,2024-06-16,high,Run box about their laugh same.
270,270,2024-11-10,high,Rather issue ten deal car computer.
271,271,2023-12-29,low,Southern write include spring like reach development public.
272,272,2024-07-16,medium,Force science if think unit.
273,273,2024-11-13,high,Cup about office may reality nice authority.
274,274,2024-01-22,high,Head image discuss rich very.
275,275,2023-07-25,high,Factor wind new dream control.
276,276,2025-01-29,low,North tough learn green.
277,277,2025-01-06,high,Simply Democrat include theory continue serious.
278,278,2023-09-30,low,Idea education social Mrs lay.
279,279,2024-04-10,low,Learn keep firm it million record environmental.
280,280,2023-11-22,medium,Account message religious its wide guess book.
281,281,2023-11-04,medium,Their keep couple tax my eye sign cell.
282,282,2023-07-16,medium,Dark market serve talk outside catch tough.
283,283,2025-03-20,medium,Maintain building trial less lawyer hour listen huge.
284,284,2023-10-22,medium,Rule job too.
285,285,2023-10-27,low,Foot artist mean even election.
286,286,2024-08-12,low,More spring instead activity.
287,287,2024-07-01,high,Ready avoid professor save notice.
288,288,2025-02-02,high,Often eat politics dark medical whose.
289,289,2023-08-05,medium,Address perform around summer offer.
290,290,2025-01-30,high,Understand music three.
291,291,2024-05-18,medium,Control direction base term west score.
292,292,2025-03-25,medium,Commercial trial return idea.
293,293,2024-06-14,high,Attack third culture common great hand whatever.
294,294,2024-04-16,low,Thought nothing land join wife sometimes space.
295,295,2024-10-02,high,Stand unit defense four force manager within second.
296,296,2024-02-03,medium,Drop technology gun center shoulder.
297,297,2024-01-01,low,Role lay environment language.
298,298,2023-07-08,high,Work customer push report compare today.
299,299,2024-05-03,high,Apply mean each stop.
300,300,2025-03-13,medium,Agree measure peace cut health thousand buy.
301,301,2024-07-26,low,Fill yet yeah clearly.
302,302,2023-09-17,high,A window at process go clear.
303,303,2024-06-20,low,Common film work indicate.
304,304,2023-10-08,low,Teacher kitchen sea fall wind prove draw.
305,305,2024-05-27,low,Pressure everything season ball make.
306,306,2025-02-09,high,Lay high theory sport leader sell.
307,307,2024-07-20,medium,Able doctor nature machine door water study.
308,308,2025-02-01,low,Important happy test represent.
309,309,2024-12-17,low,Per staff term measure.
310,310,2024-03-07,low,Oil trip effect school fill.
311,311,2023-07-02,high,Across knowledge federal indicate social blue.
312,312,2025-01-19,high,Today commercial front degree three add.
313,313,2024-10-22,low,Fine admit carry.
314,314,2023-07-16,high,Wear year might meet.
315,315,2023-05-12,high,Help design because season.
316,316,2024-11-21,high,Late year seem dog building maintain.
317,317,2024-11-21,high,Value someone magazine fire white discuss.
318,318,2024-04-13,medium,Study difficult behind three shoulder hundred represent.
319,319,2023-10-03,low,Specific attention brother control.
320,320,2023-12-02,medium,Your seem along federal probably organization capital.
321,321,2023-08-30,low,A college real end.
322,322,2025-01-13,high,Trip behavior through inside too six.
323,323,2024-06-10,low,Body purpose outside claim increase look lot.
324,324,2024-09-24,high,Carry recent when.
325,325,2024-05-29,low,Which beautiful community operation result.
326,326,2023-09-06,medium,Process stuff write own call.
327,327,2024-04-12,high,Wish college practice figure.
328,328,2024-10-09,medium,Room happy throw expect.
329,329,2023-05-25,low,Bill its structure everybody.
330,330,2024-11-15,medium,Service same reach or any article anything.
331,331,2024-02-25,medium,Price apply whether step lot throughout.
332,332,2023-12-13,high,Situation often behavior wall.
333,333,2025-02-02,high,According trouble thank have dark production.
334,334,2023-06-26,medium,Enter garden consider trouble often.
335,335,2023-09-28,low,Forget other today arm teacher.
336,336,2024-10-09,medium,According probably effect out claim appear.
337,337,2023-11-04,high,Feeling give southern at.
338,338,2023-05-28,medium,Window something high grow.
339,339,2023-12-22,medium,Budget family executive professor improve fall.
340,340,2024-03-25,low,Again drug write test own.
341,341,2023-10-15,high,Place often population.
342,342,2023-10-02,high,Suffer idea tough test market number hear often.
343,343,2024-06-20,high,Teacher center easy each spring.
344,344,2025-01-23,low,Important toward other light bit company.
345,345,2024-06-30,high,Rich lawyer sport perform blue.
346,346,2025-02-17,medium,Property fine face just do such side.
347,347,2024-11-25,medium,Beyond environmental knowledge specific others rather thus nearly.
348,348,2024-01-16,low,Risk over reveal none.
349,349,2023-09-11,medium,Whatever situation agree wait forward.
350,350,2025-03-12,medium,Father clearly detail body camera environmental whatever.
351,351,2024-06-16,medium,Most writer second low hundred institution.
352,352,2024-04-28,medium,Market develop group away process laugh much.
353,353,2024-05-05,medium,Table hit theory data use address.
354,354,2023-06-15,high,Standard management factor camera partner.
355,355,2023-05-22,low,Friend write could.
356,356,2024-04-22,medium,Hand risk too improve eat.
357,357,2023-06-20,high,Unit half be rich room.
358,358,2024-07-18,low,Research medical computer growth.
359,359,2023-07-29,low,Vote though program gun.
360,360,2024-02-21,medium,Make standard color audience help prepare.
361,361,2023-09-06,medium,Form myself rather.
362,362,2024-03-26,medium,Long eight seek focus really weight better.
363,363,2023-07-24,high,Senior drop eight someone owner place statement include.
364,364,2024-01-05,high,Nor guy stay feeling.
365,365,2023-05-19,high,Per require standard then result.
366,366,2024-09-02,high,Cause executive either traditional on land.
367,367,2024-04-27,medium,Around its argue wear few.
368,368,2024-09-24,medium,Hope probably interest specific affect she.
369,369,2024-04-28,low,Free plan beat senior second represent.
370,370,2023-10-27,medium,Everyone both just result.
371,371,2025-04-23,low,Lawyer will bring.
372,372,2023-09-20,low,New information make Mrs present step start.
373,373,2023-11-19,medium,Even deal toward many.
374,374,2024-10-03,medium,Box mission bit explain news fire.
375,375,2025-02-03,medium,Firm everything full view box.
376,376,2024-05-19,medium,Ahead federal employee sound and certain key.
377,377,2025-04-08,medium,See chance similar rise.
378,378,2024-10-09,low,National me particular control environment.
379,379,2024-06-24,high,Real message often.
380,380,2024-09-10,medium,Performance happy book whose.
381,381,2023-07-31,low,Choose realize voice whose section adult.
382,382,2023-11-01,medium,Laugh sense human film nature forward.
383,383,2024-05-10,low,Peace billion run admit.
384,384,2023-07-30,high,Finish team man never.
385,385,2025-01-17,low,Tax team mother reality among science chance together.
386,386,2023-10-07,medium,Follow writer ask upon.
387,387,2024-04-23,medium,Talk then energy name easy month rate or.
388,388,2024-02-17,low,As after particularly because.
389,389,2023-08-19,low,Thing hospital available quite.
390,390,2025-04-13,low,Natural candidate matter however those air employee on.
391,391,2024-02-16,low,Certain think night because.
392,392,2024-09-23,medium,Author decade together test young professional fact bank.
393,393,2023-07-13,high,Idea major accept civil general.
394,394,2023-07-30,medium,Should sister cold community lead hard.
395,395,2023-08-13,medium,Technology play president particularly happy family source.
396,396,2023-08-19,medium,Technology particular me including understand.
397,397,2025-02-02,high,Explain gas and.
398,398,2023-12-15,high,Church share sound leader behind ever.
399,399,2023-06-18,high,Respond economic understand hand kitchen marriage page.
400,400,2024-01-28,high,Value about we spring range new.
401,401,2024-04-12,medium,Year prepare say simply again grow account back.
402,402,2023-11-21,medium,Order claim Congress increase fill.
403,403,2024-12-19,medium,Floor recent director watch into including make.
404,404,2023-05-21,high,Lead people begin.
405,405,2024-12-23,high,State property southern movement.
406,406,2024-11-06,high,Author call model detail eat result church.
407,407,2024-03-31,low,Outside first become husband can a.
408,408,2024-03-30,high,Traditional weight no defense energy.
409,409,2024-11-23,high,Here skin fight as maintain expect.
410,410,2023-06-12,low,Customer quickly quality adult difficult least order.
411,411,2023-08-23,medium,Evidence partner item.
412,412,2023-07-05,low,Nearly family score imagine outside.
413,413,2023-09-03,high,Enough within spend blue rule plan.
414,414,2023-06-03,medium,Party defense indeed dinner yard.
415,415,2023-10-17,high,Major scientist not family leave direction apply.
416,416,2024-11-22,medium,Administration growth necessary move.
417,417,2025-01-02,low,Issue friend evidence this.
418,418,2024-04-25,high,Base different entire impact inside.
419,419,2025-03-23,low,Condition since special above past road.
420,420,2023-08-04,medium,Or dog employee interest.
421,421,2023-12-08,high,Arrive win production discussion effort cover.
422,422,2024-03-03,medium,Human report official beat would population truth.
423,423,2023-05-25,low,Lead total town result.
424,424,2023-07-28,high,Power prepare concern wife three bed.
425,425,2024-09-16,medium,Game state available professor cup our arrive.
426,426,2024-04-25,low,Can sell word crime.
427,427,2024-01-02,medium,Seek evidence bank entire.
428,428,2024-03-27,high,Finish administration hold question decide quality very.
429,429,2024-04-18,medium,No eye cost heart option act southern.
