interest_id,customer_id,survey_date,interest_level,comments
2085,2085,2024-07-06,high,Truth support bit marriage pull.
2086,2086,2024-12-12,medium,Spring night clear special benefit speech better.
2087,2087,2025-01-19,high,Light professional maybe enjoy large.
2088,2088,2024-07-28,high,Class specific future.
2089,2089,2023-09-05,low,Skin decision beat news lead.
2090,2090,2024-08-06,high,Compare traditional call indicate available.
2091,2091,2024-12-05,low,Increase beyond history government hotel.
2092,2092,2023-09-15,medium,Lawyer walk film able part more.
2093,2093,2024-06-09,medium,Road prevent though building whose.
2094,2094,2024-10-03,high,Stage cup fall education take middle.
2095,2095,2024-08-30,medium,Rest entire care side world within former.
2096,2096,2024-06-20,medium,Represent either eat thus growth bad.
2097,2097,2024-01-30,high,Amount note according stop community make hot.
2098,2098,2023-07-31,low,Create spring turn cup.
2099,2099,2024-05-15,high,Agent just rule beyond.
2100,2100,2024-06-25,medium,Natural bit partner decide stand.
2101,2101,2024-07-01,medium,Ground everyone blood day.
2102,2102,2023-08-11,high,Teach board record say.
2103,2103,2024-12-18,low,Always artist lot think institution budget.
2104,2104,2024-11-23,low,From reality total skin.
2105,2105,2023-09-16,high,Behind note late why interview.
2106,2106,2023-10-03,high,Record although relationship plan institution space.
2107,2107,2024-11-17,low,Lot ground price add.
2108,2108,2025-03-12,low,Never eat military fly.
2109,2109,2023-08-28,medium,Friend anything often Democrat.
2110,2110,2024-08-13,high,Mouth billion part exactly change close.
2111,2111,2024-11-21,high,Newspaper picture catch relationship raise concern.
2112,2112,2024-05-14,high,Growth person just describe.
2113,2113,2023-11-21,high,Only hand figure when magazine.
2114,2114,2023-10-11,high,Name coach attack say catch.
2115,2115,2023-09-12,high,Goal least reduce.
2116,2116,2024-07-03,low,Sister term suddenly physical garden.
2117,2117,2023-11-19,low,Something whole still meeting.
2118,2118,2025-02-12,high,Serious lose just pressure American early later majority.
2119,2119,2024-10-24,high,Sit pressure positive glass expert.
2120,2120,2024-01-30,low,Position you executive any type her few.
2121,2121,2023-09-22,high,Simply college listen our.
2122,2122,2023-09-02,medium,Short remember spring must camera consumer it.
2123,2123,2025-03-30,high,Adult section join perhaps seem.
2124,2124,2024-09-23,low,Part treatment statement himself true media.
2125,2125,2024-09-26,high,City film food organization available reach might.
2126,2126,2025-02-26,medium,Toward happy similar.
2127,2127,2025-01-09,low,Property within letter player.
2128,2128,2023-10-30,medium,Never I likely condition hard top.
2129,2129,2024-12-05,high,Director very natural write hundred arrive push.
2130,2130,2023-06-04,medium,Series they girl.
2131,2131,2025-01-10,high,Science conference agreement sound race hope deal eye.
2132,2132,2023-08-26,high,Almost air send night son oil.
2133,2133,2025-04-19,high,Push soon activity.
2134,2134,2024-10-01,low,Tax fast medical able film time million.
2135,2135,2025-02-02,medium,Run hotel Mr phone.
2136,2136,2023-12-13,high,Season line pick yes hotel effort.
2137,2137,2024-11-17,medium,Idea goal instead relationship kid five when.
2138,2138,2024-07-23,low,Throughout now political board since factor.
2139,2139,2023-05-30,medium,Unit expect system player discuss positive soon.
2140,2140,2023-09-12,high,Director society media floor language computer.
2141,2141,2024-02-16,low,Upon I require plan magazine.
2142,2142,2024-03-23,low,View create book detail.
2143,2143,2024-07-13,high,Capital good your act there of.
2144,2144,2023-11-13,low,Board use customer computer thing opportunity.
2145,2145,2023-09-30,low,Care above simply and movement.
2146,2146,2024-04-06,medium,Position event success response provide.
2147,2147,2023-08-21,high,Pressure various while foreign.
2148,2148,2024-04-25,low,Million wear thing time reality necessary employee.
2149,2149,2024-08-23,low,How pass half bit.
2150,2150,2023-09-25,low,Leader Republican Republican drop black TV high.
2151,2151,2024-07-13,low,Other again nature.
2152,2152,2023-08-18,medium,Participant win child both.
2153,2153,2025-01-04,medium,Scientist have modern woman matter break.
2154,2154,2025-01-04,low,Difficult assume doctor stuff wife until not.
2155,2155,2024-03-01,medium,Choose item section leader customer go.
2156,2156,2025-01-01,medium,Outside spring front build.
2157,2157,2023-07-20,low,Attack floor hot medical television begin.
2158,2158,2024-11-03,high,Without win arrive challenge cultural practice.
2159,2159,2024-06-02,low,Democrat increase analysis management.
2160,2160,2024-06-30,medium,Player ahead leg listen maintain.
2161,2161,2024-05-27,medium,Sure series alone rule every pretty.
2162,2162,2024-08-02,low,Serve generation say experience.
2163,2163,2023-07-16,low,Age paper allow mean state.
2164,2164,2024-01-22,high,Real bar job small magazine government.
2165,2165,2023-12-07,low,Style religious buy.
2166,2166,2024-05-25,high,Turn none whether at theory vote.
2167,2167,2024-02-01,low,Paper black design green six together.
2168,2168,2024-03-29,low,Support rule former box relate security shoulder.
2169,2169,2023-07-15,high,Argue claim ground from.
2170,2170,2025-01-03,low,Operation five herself collection soldier describe effect.
2171,2171,2023-11-20,low,Participant late big per campaign turn late.
2172,2172,2024-11-27,low,Still billion population lose instead really option material.
2173,2173,2024-09-05,low,Away perform employee.
2174,2174,2025-02-06,medium,Family cover according serve.
2175,2175,2023-05-20,high,Help wall test trip.
2176,2176,2024-04-05,medium,Physical across part use skin field the.
2177,2177,2024-08-16,high,Until image serve me.
2178,2178,2024-09-14,high,Use toward key enough.
2179,2179,2024-11-26,low,Central common may own against simply.
2180,2180,2023-09-02,low,Heart send raise some.
2181,2181,2024-04-23,low,Radio need special study especially area.
2182,2182,2025-04-22,medium,Sea gun protect under grow.
2183,2183,2025-01-11,medium,Writer hard service certainly tell.
2184,2184,2024-10-24,medium,Manage throughout often whether might.
2185,2185,2023-05-11,high,Maintain over truth ok trip either.
2186,2186,2023-08-18,low,Heart themselves because later product for.
2187,2187,2023-09-07,low,Future power partner next.
2188,2188,2023-12-24,low,Hear soon smile set miss system.
2189,2189,2023-07-01,medium,While specific age administration.
2190,2190,2024-06-16,low,Fine time team grow concern we detail.
2191,2191,2024-07-06,high,Thing wife food time city each.
2192,2192,2024-06-22,low,Others daughter me money bed history wear.
2193,2193,2024-09-09,medium,Peace Mrs process responsibility floor unit whether.
2194,2194,2024-02-15,high,Summer challenge item when you explain citizen see.
2195,2195,2025-03-19,high,Follow pressure sure best project forward tonight green.
2196,2196,2025-01-19,high,His according fine government receive.
2197,2197,2025-02-12,high,Should especially attention walk herself.
2198,2198,2024-05-29,low,Experience building south fight card hear.
2199,2199,2024-02-09,high,Thus key clearly camera over.
2200,2200,2023-06-12,low,Off phone second bit receive focus chance.
2201,2201,2024-09-12,low,Check some item.
2202,2202,2024-08-04,high,Fire book board require grow behavior available make.
2203,2203,2024-10-01,medium,Return edge more talk truth forward company.
2204,2204,2023-09-10,medium,Report wide total drive.
2205,2205,2023-08-28,low,Professional begin pay since.
2206,2206,2023-05-18,high,Thing century ten leader weight.
2207,2207,2023-10-30,low,Least within after behind decide whole.
2208,2208,2024-11-28,medium,Heavy manage myself weight fall.
2209,2209,2023-06-16,medium,Without police executive conference clear.
2210,2210,2023-06-30,low,Chair teacher stage success government.
2211,2211,2024-10-10,medium,Bank region everybody scene.
2212,2212,2024-10-04,low,Record high conference performance marriage.
2213,2213,2024-07-04,low,Us result ahead field city produce morning baby.
2214,2214,2025-03-02,medium,Relate order discuss to too three.
2215,2215,2025-02-02,high,Word trial upon financial house true single our.
2216,2216,2023-09-26,low,Admit dinner head religious finish very career.
2217,2217,2025-02-27,medium,Spring half nice present great suffer actually.
2218,2218,2025-01-30,high,Likely detail throughout consider number that out.
2219,2219,2024-01-13,medium,Second challenge score several development.
2220,2220,2023-08-03,medium,Offer born indicate join lose.
2221,2221,2024-09-01,low,South meet above price college cover drop thank.
2222,2222,2024-06-04,medium,Himself protect know.
2223,2223,2023-05-05,high,Thousand administration modern TV study economic significant.
2224,2224,2024-02-29,low,Treatment term guy blood range whether push.
2225,2225,2023-11-24,low,Right data perform development offer.
2226,2226,2023-11-12,medium,Myself fire simple candidate during.
2227,2227,2024-11-13,low,Century along answer head a and lay arm.
2228,2228,2023-09-11,low,Hot dream both.
2229,2229,2024-08-13,high,Professor memory hand toward.
2230,2230,2023-11-30,high,Cultural avoid lawyer center nothing discover.
2231,2231,2023-06-06,high,Plant see will ok.
2232,2232,2023-05-08,high,Color name activity here.
2233,2233,2024-03-11,low,Avoid person suffer official.
2234,2234,2024-02-06,low,Each he former manage forget professor bag artist.
2235,2235,2024-06-27,high,Actually sit agency expect walk everything.
2236,2236,2024-10-18,high,Only choice former reach fish condition.
2237,2237,2023-07-05,low,Remember get line compare nation two lead.
2238,2238,2024-06-19,high,Red pass without first out.
2239,2239,2023-05-17,low,Dog watch though former into say.
2240,2240,2023-05-17,medium,Whatever American rise once local.
2241,2241,2023-08-02,high,Can issue none.
2242,2242,2023-12-29,low,Word must air.
2243,2243,2024-02-17,medium,Enough food game expert.
2244,2244,2024-07-23,medium,Defense team me training human necessary provide.
2245,2245,2024-03-16,low,Goal six sea lot hotel despite sport.
2246,2246,2024-06-29,high,Skin student century you should after.
2247,2247,2025-03-18,high,Civil place oil follow for.
2248,2248,2025-03-07,medium,Forward way for.
2249,2249,2024-01-23,high,Window establish I join agent.
2250,2250,2024-03-15,medium,Age red trade official sit people whose.
2251,2251,2023-05-27,high,Sign morning I economic.
2252,2252,2024-01-19,medium,Wrong small from prepare music.
2253,2253,2025-04-19,high,South much lose your notice two them.
2254,2254,2024-11-25,high,Resource allow bring process war real.
2255,2255,2023-12-03,high,Positive positive behavior their.
2256,2256,2023-05-30,low,Decide by clear.
2257,2257,2023-07-29,medium,Describe city forward low picture recognize pressure.
2258,2258,2023-12-15,high,Energy who simple help fast field side.
2259,2259,2023-12-15,high,Mrs hand amount against fear nature he.
2260,2260,2023-04-26,low,Bring entire save determine more arm.
2261,2261,2024-05-25,high,Hit stop article detail ever knowledge fire.
2262,2262,2024-07-11,low,Fine star sister husband though change stuff.
2263,2263,2025-01-14,low,Its mean have safe type thousand pass.
2264,2264,2024-01-23,high,Case likely nor like agency.
2265,2265,2024-07-12,medium,Buy race physical without any charge take.
2266,2266,2024-09-17,medium,Camera gun sign while option next.
2267,2267,2023-07-20,medium,Always catch the shoulder resource.
2268,2268,2023-07-20,high,Design want drive view suggest life.
2269,2269,2023-07-25,medium,Entire my party way certainly show identify east.
2270,2270,2024-06-30,medium,Lot close know poor research.
2271,2271,2024-12-28,high,Especially yard huge push law.
2272,2272,2023-10-10,low,Whose along collection tax.
2273,2273,2024-12-03,low,Will fall nice again here knowledge.
2274,2274,2024-11-23,medium,Bill tell though of.
2275,2275,2024-12-08,high,I piece foreign outside.
2276,2276,2023-05-12,high,Institution behavior his also.
2277,2277,2024-04-01,medium,Represent resource believe.
2278,2278,2024-11-20,high,Market idea full that some hard.
2279,2279,2024-03-30,low,Rich quality full market very laugh.
2280,2280,2023-05-26,high,Forget economy between piece left whole.
2281,2281,2024-02-07,medium,Phone dark beat detail business.
2282,2282,2023-11-22,medium,White individual father these tell plant find.
2283,2283,2024-06-15,low,Dog top series power occur side study.
2284,2284,2024-08-14,high,Hospital past truth billion.
2285,2285,2023-10-06,medium,Deep end several lawyer yet when.
2286,2286,2024-04-11,low,Make enter task.
2287,2287,2023-11-04,high,Medical system benefit little outside lead reason.
2288,2288,2023-08-18,medium,Behind wide word know practice stuff forget.
2289,2289,2023-10-02,low,Which answer remember myself.
2290,2290,2023-06-18,low,Soldier two look or media space probably.
2291,2291,2023-06-23,low,Research resource different Mr truth short first.
2292,2292,2023-10-24,medium,In recognize evidence value itself.
2293,2293,2023-06-05,low,Work yes recently with law heart cut.
2294,2294,2023-12-28,medium,Drug third fly reason join.
2295,2295,2024-08-04,high,Fly leader ok high store role production.
2296,2296,2024-04-04,medium,Suddenly represent value value.
2297,2297,2023-05-10,low,Where method half off then.
2298,2298,2024-05-04,high,Seat effect body art onto.
2299,2299,2025-04-12,low,Where foot behavior have sit series conference.
2300,2300,2025-03-20,medium,Nothing continue strategy where.
2301,2301,2025-03-21,low,Growth your them great work floor.
2302,2302,2024-10-02,medium,Discuss reflect use despite well yeah.
2303,2303,2024-07-20,high,Public information whether human much.
2304,2304,2024-09-01,medium,Spend page front beyond analysis to sure.
2305,2305,2025-03-13,medium,Term support street.
2306,2306,2023-11-01,medium,Language approach citizen notice beautiful.
2307,2307,2024-03-12,low,Mr from middle use former community.
2308,2308,2023-11-24,high,Model compare glass far red.
2309,2309,2024-08-11,medium,Media here smile without down.
2310,2310,2023-12-12,medium,When son both agent cup.
2311,2311,2023-12-16,low,Music produce method television size off peace.
2312,2312,2023-07-09,high,Red station around fight.
2313,2313,2024-09-09,low,Radio point dark leader bill house reveal.
2314,2314,2024-10-06,low,Use whole one get kitchen customer light.
2315,2315,2024-06-12,low,About citizen break they adult light eat three.
2316,2316,2024-11-24,low,Society happy dark.
2317,2317,2023-09-20,low,Choose investment toward.
2318,2318,2024-05-09,low,Want break fall give many.
2319,2319,2024-09-20,high,Happen their remain.
2320,2320,2025-03-15,high,Member more return window indeed either full.
2321,2321,2025-01-28,high,Movie gun he car story.
2322,2322,2024-01-20,low,News party my matter increase bag.
2323,2323,2023-05-13,high,Help bad country then.
2324,2324,2025-01-03,low,Before station kitchen during.
2325,2325,2024-11-25,high,Fund forget clear easy sing course either watch.
2326,2326,2024-07-19,low,Read do wait billion black describe.
2327,2327,2023-06-09,high,Fire family Mrs hair training ever.
2328,2328,2023-05-16,low,Weight agreement today how trade design might.
2329,2329,2024-04-03,low,Foreign point weight century probably.
2330,2330,2024-06-07,low,Will available none three wife.
2331,2331,2023-08-06,low,Seem hundred certain.
2332,2332,2024-06-12,low,Relationship close reality call source.
2333,2333,2024-09-24,low,Year laugh what hear however network buy.
2334,2334,2024-08-04,low,Media knowledge ok.
2335,2335,2025-01-05,low,Certainly her avoid subject.
2336,2336,2024-02-06,low,Pass major range cost.
2337,2337,2023-07-28,high,Science long western exist.
2338,2338,2023-08-03,medium,Left author all he traditional very.
2339,2339,2024-05-06,high,Floor budget agent book record maintain fear.
2340,2340,2024-03-04,medium,Turn choose design find.
2341,2341,2024-09-17,high,Consider away customer or apply dog writer carry.
2342,2342,2023-12-03,high,Gun within officer.
2343,2343,2024-06-16,high,Condition debate quite machine during relate fire.
2344,2344,2024-11-22,medium,Partner heart I senior.
2345,2345,2024-12-01,high,Need foot reflect left who.
2346,2346,2024-10-21,low,Nothing seat the challenge.
2347,2347,2024-03-14,medium,Civil better culture cup fall word fill.
2348,2348,2023-05-20,high,Focus program long environmental area effort forget.
2349,2349,2024-12-13,high,Me look PM.
2350,2350,2023-09-09,medium,Decade save possible for.
2351,2351,2024-03-28,medium,Walk throw staff.
2352,2352,2024-07-17,medium,Real enter box read.
2353,2353,2024-05-04,high,Job manage special including item goal wide create.
2354,2354,2024-06-21,high,Appear cup laugh represent piece book not.
2355,2355,2025-01-01,low,Decide sell right learn human these relate notice.
2356,2356,2024-07-13,medium,Best offer road through he easy easy.
2357,2357,2024-08-16,high,Ago commercial deep health phone first.
2358,2358,2025-02-09,low,Performance outside couple finish.
2359,2359,2024-06-17,medium,Reveal all forget role safe.
2360,2360,2023-06-16,high,Much weight sign whatever.
2361,2361,2024-10-07,low,Push PM tonight.
2362,2362,2023-10-13,medium,Catch question whose occur.
2363,2363,2024-05-28,low,Pull hair sometimes surface lose trial speech out.
2364,2364,2025-01-30,high,Sort one identify theory spring source too itself.
2365,2365,2024-05-22,medium,Father beautiful type matter since main message.
2366,2366,2023-05-16,medium,Particularly seek too.
2367,2367,2023-05-04,medium,Whom least worry image list key operation.
2368,2368,2024-03-09,low,Because high similar gas leader reality mean.
2369,2369,2024-09-19,medium,Buy away affect sign ok.
2370,2370,2025-03-31,low,Nor call glass fish memory against.
2371,2371,2024-03-04,medium,Conference identify respond start.
2372,2372,2024-10-20,high,Nice raise room senior product detail.
2373,2373,2024-12-08,low,War her assume.
2374,2374,2024-09-28,low,While modern add keep director.
2375,2375,2024-06-04,medium,Be discuss staff although practice visit determine.
2376,2376,2024-02-27,high,Travel threat red national himself.
2377,2377,2024-04-13,high,Year language occur audience save especially.
2378,2378,2024-08-22,high,Ball suddenly party five the her.
2379,2379,2024-12-30,low,Upon become wear side.
2380,2380,2025-03-30,high,Require any just writer miss her.
2381,2381,2023-10-21,low,Nothing even second bank type I.
2382,2382,2025-04-07,low,Create news us serve season.
2383,2383,2024-11-10,low,Exist send tax leg official again voice church.
2384,2384,2023-08-02,low,Must rich yet return spend response series.
2385,2385,2024-03-17,low,Medical on produce letter recently dark.
2386,2386,2024-05-30,low,Control themselves base score night.
2387,2387,2023-12-18,high,Community research until.
2388,2388,2024-01-15,low,Challenge note realize back pick himself.
2389,2389,2023-09-29,low,Dark how when capital over military.
2390,2390,2023-06-16,high,See street husband every determine.
2391,2391,2025-04-22,low,Worker response group necessary my others.
2392,2392,2023-04-30,medium,Ball question picture.
2393,2393,2023-06-19,low,Sell why pay.
2394,2394,2024-05-29,low,Never fly at million claim.
2395,2395,2023-05-28,medium,Several affect lot affect at north same.
2396,2396,2023-05-28,medium,Lot clear do each foot product report.
2397,2397,2024-01-10,medium,Goal task market difference tree style.
2398,2398,2025-04-12,low,Structure but believe.
2399,2399,2024-03-17,low,Class simply industry none apply behind six.
2400,2400,2025-04-09,high,Travel stuff actually go window.
2401,2401,2024-01-03,high,Call case style sometimes front.
2402,2402,2024-10-21,medium,Reveal candidate natural arrive.
2403,2403,2024-08-16,medium,Official save nothing others.
2404,2404,2023-08-03,high,Imagine former add scene itself himself end.
2405,2405,2024-07-20,medium,Board push and them.
2406,2406,2024-03-11,high,Affect share no room wife shake do.
2407,2407,2024-06-21,high,Official majority turn toward story.
2408,2408,2023-09-07,medium,Person mission provide ever necessary.
2409,2409,2023-10-10,high,Represent only number receive white Mrs herself.
2410,2410,2025-01-19,high,Hair water stock federal always.
2411,2411,2025-02-20,high,Short subject because.
2412,2412,2024-03-09,low,Your shake spring almost song great.
2413,2413,2024-11-09,low,Right affect before night.
2414,2414,2024-03-28,low,Throw never financial building.
2415,2415,2023-12-30,medium,Avoid animal have bring in sign kid.
2416,2416,2023-12-12,medium,Nature left ago pattern mention.
2417,2417,2024-06-04,high,Involve small goal agency sea animal government.
2418,2418,2024-08-06,high,Wall cultural space.
2419,2419,2023-10-27,high,Instead bad in success ten.
2420,2420,2023-07-14,medium,Matter share resource of southern certainly.
2421,2421,2024-10-08,high,Sell she energy lawyer.
2422,2422,2024-12-30,low,Site group public science it left.
2423,2423,2023-06-14,medium,True possible watch no law.
2424,2424,2024-05-01,low,Heart scientist suffer her with sometimes.
2425,2425,2024-04-16,low,Together opportunity conference model measure little beautiful look.
2426,2426,2024-06-07,medium,Son at work hundred always finally also outside.
2427,2427,2024-12-10,medium,Establish sometimes eight talk generation.
2428,2428,2023-09-08,high,Blue discover management mother military.
2429,2429,2023-12-23,medium,Policy notice stage small.
2430,2430,2023-10-11,medium,Protect water garden thus today economic.
2431,2431,2024-09-28,high,Ball foreign result including then.
2432,2432,2023-05-26,high,History policy sport perhaps discussion this force.
2433,2433,2024-06-02,medium,Economic score anyone enter should.
2434,2434,2025-04-07,low,Accept produce product group.
2435,2435,2025-02-22,medium,Including prepare debate raise truth want themselves.
2436,2436,2024-04-12,low,Include stop picture main south federal.
2437,2437,2024-05-20,high,Throughout stand live.
2438,2438,2023-09-08,high,Unit performance me prevent throughout.
2439,2439,2025-04-17,medium,Expect somebody think far wall.
2440,2440,2024-07-23,high,Pattern research loss moment cut.
2441,2441,2023-08-10,medium,Play television here amount subject.
2442,2442,2024-03-20,low,Forward set people so wall.
2443,2443,2024-06-15,medium,Unit itself mean leave raise force.
2444,2444,2024-11-01,high,Glass second blood tough.
2445,2445,2024-08-21,high,Computer Congress look company.
2446,2446,2024-02-26,high,Hotel cup common present.
2447,2447,2023-08-29,high,Pressure difficult small near company eye bar.
2448,2448,2023-09-16,low,Even forget real move.
2449,2449,2025-02-04,low,Rate born situation company phone summer.
2450,2450,2024-08-11,high,Cup buy way analysis customer.
2451,2451,2024-05-19,high,Hospital agent sing.
2452,2452,2024-07-08,medium,Race already upon have improve century.
2453,2453,2024-11-29,high,Around east left understand.
2454,2454,2025-01-31,high,Police smile spend decide store.
2455,2455,2023-09-17,high,Service writer listen situation.
2456,2456,2023-10-23,high,That by such reveal police officer value.
2457,2457,2024-02-10,high,Trade none draw decide growth sport.
2458,2458,2023-09-21,medium,Teacher property design try trip total dark.
2459,2459,2024-03-09,high,Ever realize my professor west leg.
2460,2460,2025-01-19,low,City occur remain owner spend need.
2461,2461,2023-10-22,high,Weight significant matter apply another available become exactly.
2462,2462,2024-09-11,medium,Republican world magazine foot source local cup life.
2463,2463,2024-12-13,high,Congress act Mrs.
2464,2464,2024-11-10,high,Activity myself lay man scene.
2465,2465,2024-03-14,medium,Friend phone chair administration once.
2466,2466,2023-07-08,low,Project model why.
2467,2467,2024-12-16,medium,Expect meeting fund along type perhaps.
2468,2468,2024-12-14,low,Six page expect analysis view member.
2469,2469,2025-02-01,high,Image commercial go else place far key.
2470,2470,2023-08-24,high,Trip or forward lead.
2471,2471,2024-06-04,high,Politics focus call.
2472,2472,2023-09-07,high,Indeed author particularly end within.
2473,2473,2025-04-11,medium,He money tax.
2474,2474,2023-12-01,medium,Of including law shake hot.
2475,2475,2025-01-25,medium,Them the in if yet.
2476,2476,2024-11-04,medium,Hour popular floor exactly project various become.
2477,2477,2025-01-24,high,Blood range almost upon discussion.
2478,2478,2024-02-23,medium,Wind provide phone speak.
2479,2479,2024-06-22,medium,Bill north according watch reach.
2480,2480,2025-02-25,medium,Pull American live agreement true market.
2481,2481,2023-10-12,high,State huge perform player over.
2482,2482,2025-01-13,high,Commercial laugh each.
2483,2483,2024-01-05,low,Contain it attorney her wish fast international.
2484,2484,2024-01-07,high,Through finally save ability wind true.
2485,2485,2025-04-15,low,Fish popular rise base.
2486,2486,2024-06-08,high,Trial well necessary exactly follow else let civil.
2487,2487,2024-09-15,high,Wait bed anything receive hair.
2488,2488,2024-11-08,low,Within author have hear side image star sense.
2489,2489,2023-11-29,low,Late why shake everything sense.
2490,2490,2023-06-25,medium,Shoulder charge within option wait.
2491,2491,2024-04-22,high,Third too describe save civil similar.
2492,2492,2023-05-09,high,Miss until live participant number agreement difference.
2493,2493,2025-01-24,low,Manager strong marriage field camera.
2494,2494,2023-10-25,low,Save probably country forward.
2495,2495,2024-03-04,high,Air stop expect they collection.
2496,2496,2024-02-12,high,Instead suggest name something wall.
2497,2497,2023-11-30,low,Painting effect company into.
2498,2498,2023-09-27,low,General including assume push space white protect.
2499,2499,2025-02-21,high,Task position country success.
2500,2500,2023-07-02,medium,Head understand arrive board prove remember offer.
2501,2501,2024-09-17,low,Beat consider sit raise.
2502,2502,2024-02-28,low,Sure effect specific along method voice.
