interest_id,customer_id,survey_date,interest_level,comments
850,850,2025-03-27,high,Practice develop least Republican board eye.
851,851,2023-12-18,medium,Build now Republican become place six lot stuff.
852,852,2023-04-25,medium,Development face service power whole player view.
853,853,2023-10-13,low,Good believe upon art despite.
854,854,2024-03-20,medium,Ten interesting although population.
855,855,2024-06-30,medium,Heavy show east common total know agree.
856,856,2025-03-19,medium,Until to marriage whom throughout prepare character stay.
857,857,2023-08-12,medium,Within difficult follow support only perhaps.
858,858,2023-06-13,medium,Quite no surface.
859,859,2024-02-18,low,Large team quite security page American still.
860,860,2024-08-03,medium,Peace ever figure watch wait then.
861,861,2025-03-19,low,Service here student exactly foreign last cold notice.
862,862,2023-09-18,medium,Fly question conference foot.
863,863,2023-07-20,low,Pick probably order office firm anyone.
864,864,2023-08-14,medium,Music course interesting attorney station miss.
865,865,2023-12-30,low,Agency none we plan.
866,866,2024-03-02,high,Entire watch method yard hour church.
867,867,2024-12-01,medium,Teach watch food.
868,868,2023-06-30,high,Score owner own step out try able sit.
869,869,2023-10-28,high,Staff there senior author.
870,870,2024-04-26,medium,Hour international push though speak agent oil fire.
871,871,2023-10-09,low,Agree natural international decade party.
872,872,2024-04-19,medium,Or way business consider up.
873,873,2023-08-02,medium,Personal measure my together gun second level.
874,874,2024-12-17,medium,Approach wear firm citizen.
875,875,2023-07-22,medium,Low live floor left consider alone minute.
876,876,2024-12-20,medium,Bill such which every career mention full argue.
877,877,2024-10-19,medium,Travel leader pattern seven.
878,878,2024-01-25,high,Within add a discuss must during thought.
879,879,2025-01-09,low,Already kind unit common rock computer.
880,880,2024-06-17,high,Maintain grow become hour avoid also.
881,881,2023-06-14,medium,Strong actually tax.
882,882,2024-05-02,low,Then effect eight computer who personal.
883,883,2024-12-26,medium,Offer move different hour day subject.
884,884,2024-07-06,low,Behavior work over force.
885,885,2025-03-16,high,Now enter when so.
886,886,2024-12-20,high,Draw since manager drive.
887,887,2024-05-16,high,Station claim soon business require when parent.
888,888,2024-08-01,low,Radio food close avoid process staff dinner.
889,889,2025-01-02,low,Mention represent girl eye.
890,890,2023-09-19,medium,Represent budget capital finally guy war increase.
891,891,2023-09-23,low,Director save crime central.
892,892,2024-08-11,high,Lay poor theory large.
893,893,2024-06-07,medium,Company drop away campaign.
894,894,2023-08-02,high,Throughout physical pull maintain.
895,895,2024-01-05,medium,Poor voice direction quality chance miss.
896,896,2025-03-26,high,Rate what part clear above stage.
897,897,2025-02-22,high,Ask media style respond like dinner my.
898,898,2023-11-04,high,Television note billion family professor value.
899,899,2024-02-28,medium,Campaign help rich.
900,900,2023-05-02,low,Finally pick just some as campaign.
901,901,2023-12-04,medium,Difference rise concern onto wall usually five.
902,902,2024-08-28,medium,Meet less continue detail smile.
903,903,2024-06-23,high,Say population ask area vote produce win phone.
904,904,2024-03-24,low,Both rich election.
905,905,2023-05-05,medium,Radio whom art reduce couple capital.
906,906,2024-07-24,low,Four until seven structure door together their.
907,907,2023-05-11,low,Project project show similar bit course ground.
908,908,2024-07-11,low,Brother project total company work reflect decision.
909,909,2025-04-22,high,Tax trouble civil happy official reduce them appear.
910,910,2024-10-21,high,Head series me position.
911,911,2024-10-10,low,During last staff debate.
912,912,2025-03-23,low,Reflect meet culture news radio seem control.
913,913,2024-09-24,high,Notice chance while easy modern still.
914,914,2024-06-17,medium,Know low parent because wear threat.
915,915,2025-01-04,high,Family government area Mr into.
916,916,2025-02-14,medium,Page risk including join level.
917,917,2023-07-25,medium,Present since fish laugh else ability nor.
918,918,2023-12-10,high,Better such huge.
919,919,2024-09-09,high,Church include rule.
920,920,2023-09-17,high,Still network media necessary author.
921,921,2025-01-30,low,Card water hold month art girl.
922,922,2024-02-25,high,Tough explain popular trouble certain debate.
923,923,2023-05-22,high,Task myself wear week name ball.
924,924,2023-07-09,medium,I west while career but.
925,925,2023-11-23,low,Nation idea memory red.
926,926,2024-06-02,medium,Along heavy since deep involve record.
927,927,2023-06-29,low,Race performance another.
928,928,2023-10-10,low,Half mouth before goal can.
929,929,2023-11-08,medium,Without good soon.
930,930,2023-05-07,high,Model skill culture near.
931,931,2024-09-26,high,Do treat tonight authority might southern case economic.
932,932,2024-09-03,medium,Fact occur catch.
933,933,2024-07-27,medium,Prevent believe goal out operation serious cost.
934,934,2024-07-19,high,Room always administration away get site.
935,935,2024-10-26,high,Lot increase occur million color stuff decade.
936,936,2024-10-06,low,Prevent service power fact place same per.
937,937,2023-07-29,medium,Second marriage during heavy.
938,938,2023-06-20,high,Sing my those.
939,939,2024-03-11,medium,Write race nor who.
940,940,2025-03-27,medium,Guy car painting feel style.
941,941,2024-04-19,high,Own conference media voice.
942,942,2024-06-14,high,Stock significant spring phone company.
943,943,2024-02-27,low,Mrs operation bring yet.
944,944,2023-09-17,low,Husband bar physical record writer.
945,945,2023-07-25,low,Gun heavy agent reveal analysis law.
946,946,2023-05-13,medium,Figure product thank.
947,947,2024-02-09,medium,Tonight whom still stand rock young enter try.
948,948,2024-03-30,low,Class street main.
949,949,2024-07-22,high,Skin ball law.
950,950,2024-12-20,medium,Story though avoid task civil.
951,951,2023-12-03,high,Happen trouble assume pick tell onto.
952,952,2025-01-14,medium,Realize simply home about make seek.
953,953,2024-09-15,high,Wonder size hold late.
954,954,2024-09-19,high,Thus news state anything risk whom.
955,955,2024-02-22,medium,Cover happy open political.
956,956,2023-11-06,high,Who cut policy attention thus suffer party.
957,957,2023-09-03,medium,People into nor kid half charge.
958,958,2023-06-24,medium,Edge memory recognize indeed student myself.
959,959,2024-05-08,high,His yard far realize agency president record.
960,960,2023-07-06,low,Information remain professor local.
961,961,2024-06-08,medium,Line continue can material debate.
962,962,2023-05-29,medium,Little you as audience ahead recognize national.
963,963,2024-07-26,medium,Past trial set class.
964,964,2023-05-05,high,Special now bar within hear.
965,965,2023-10-06,medium,Enough message form hot.
966,966,2023-08-20,medium,Concern how morning Mr.
967,967,2023-12-29,low,He then keep remain have control.
968,968,2024-06-24,high,Wear ever PM seek forward.
969,969,2023-12-17,high,Old production fly day training.
970,970,2023-05-27,high,Drug care activity.
971,971,2024-08-14,low,Woman book instead speak knowledge recently.
972,972,2023-10-15,low,Clear today plant strategy mean this foot.
973,973,2023-11-16,high,If physical method recognize.
974,974,2024-06-01,medium,Visit use list move do most allow.
975,975,2024-08-13,medium,Close drug agreement mean simple politics role center.
976,976,2024-09-22,low,Bring consumer follow before job.
977,977,2023-11-12,high,Newspaper score they unit smile issue probably.
978,978,2025-04-03,medium,Across news central interview friend rate rich.
979,979,2024-07-03,high,Party attack just human.
980,980,2023-05-17,high,Population throughout west white middle key.
981,981,2024-10-16,high,The area leg sure every.
982,982,2024-12-02,medium,Science hour full child.
983,983,2024-12-04,high,Other whose notice impact.
984,984,2024-06-08,medium,Figure stage help indicate ahead any.
985,985,2023-06-19,medium,Range ask if out.
986,986,2024-04-24,high,Himself deep approach word hospital than.
987,987,2024-03-26,high,Rise fight never.
988,988,2024-02-04,medium,Put girl institution.
989,989,2023-05-18,medium,Wide boy office throw.
990,990,2024-07-25,medium,None finally with almost.
991,991,2023-05-03,medium,Over through position pattern claim gun use.
992,992,2024-06-21,low,Use third inside actually five thought because.
993,993,2025-02-01,medium,Body unit minute pay remain everything site.
994,994,2024-11-10,low,Ok there well politics Congress.
995,995,2025-02-05,low,Value bed at next.
996,996,2024-08-07,high,Prevent type she west rich.
997,997,2023-05-16,medium,The similar say worry rich strong opportunity month.
998,998,2025-04-24,medium,Partner interest challenge ready.
999,999,2024-11-01,medium,Put seat special.
1000,1000,2024-01-01,medium,Health imagine may tough.
1001,1001,2024-09-07,high,Product identify assume be away organization people.
1002,1002,2024-12-11,medium,Day include personal occur do thought.
1003,1003,2023-08-07,high,Six inside health national history.
1004,1004,2024-05-12,low,Although raise already at system actually maybe past.
1005,1005,2025-01-19,low,Recently central bit official specific responsibility.
1006,1006,2023-08-24,medium,Traditional hard above though member.
1007,1007,2023-05-18,high,Hit pattern act better blue manager indeed wide.
1008,1008,2025-04-02,medium,Military against professor beyond section.
1009,1009,2023-12-30,low,Play agreement tax force.
1010,1010,2024-06-02,low,Executive between number energy practice day.
1011,1011,2024-11-21,low,Similar step security history.
1012,1012,2023-12-17,high,Trouble carry my training be them.
1013,1013,2023-08-20,medium,Including information use mean short.
1014,1014,2024-12-03,medium,Test decade unit.
1015,1015,2023-10-30,medium,Be white program six line.
1016,1016,2024-12-02,medium,Character including west best develop discuss ago edge.
1017,1017,2024-02-27,high,Main however rest consumer finish describe product.
1018,1018,2023-09-18,medium,Often happy control.
1019,1019,2024-01-02,medium,Walk Democrat everybody amount deep southern probably.
1020,1020,2023-12-08,medium,They bit popular exactly set physical.
1021,1021,2024-04-30,high,Offer artist girl next remember.
1022,1022,2024-08-08,high,Family offer teach response risk.
1023,1023,2023-08-01,low,Woman oil take guy capital dinner.
1024,1024,2023-12-24,high,Heart performance specific learn question.
1025,1025,2025-02-06,high,Property region civil lay if morning history baby.
1026,1026,2023-07-24,high,Spend else air check general behavior.
1027,1027,2024-09-28,medium,Imagine black ten shoulder herself.
1028,1028,2023-12-12,low,Concern color one up see too mother.
1029,1029,2024-07-10,medium,Pretty investment nearly other will.
1030,1030,2024-04-24,medium,News stay half expect pick job week try.
1031,1031,2024-06-14,low,Analysis your school woman weight.
1032,1032,2023-09-28,high,Politics maybe focus enough thought should.
1033,1033,2024-01-09,high,Federal fund mother but rather.
1034,1034,2024-02-27,low,Major chair performance lawyer them character weight.
1035,1035,2025-02-17,low,Still likely certain.
1036,1036,2024-02-12,low,Kind reflect culture board.
1037,1037,2024-10-28,medium,Bill news none all.
1038,1038,2024-07-30,high,Sense how continue yourself month range north series.
1039,1039,2023-06-28,medium,Traditional author main above run all any discuss.
1040,1040,2024-09-06,high,Expert think surface.
1041,1041,2024-08-25,medium,Career protect like effort step political.
1042,1042,2023-12-16,high,Listen by run administration choose wait.
1043,1043,2023-08-27,high,Evidence recent future fire single medical value.
1044,1044,2025-03-22,medium,Popular anything staff they mission establish food.
1045,1045,2023-08-31,low,Save white administration.
1046,1046,2024-07-24,low,Company read produce responsibility product consumer per girl.
1047,1047,2024-06-18,high,Forget economy fish dark situation.
1048,1048,2024-08-23,low,Long perhaps respond bag especially.
1049,1049,2025-04-05,high,Reflect what trip thought also arm too stand.
1050,1050,2025-03-06,low,Huge back determine about.
1051,1051,2023-05-19,low,Mind you land.
1052,1052,2025-04-05,medium,Street list above throughout window tonight citizen.
1053,1053,2023-10-29,medium,Exist it government we relate think.
1054,1054,2023-11-21,high,Strategy behavior performance real.
1055,1055,2024-04-03,medium,Bring notice water activity thought make allow situation.
1056,1056,2025-01-30,medium,Court important even power executive.
1057,1057,2025-03-20,high,Partner live card site eye leader everybody.
1058,1058,2023-04-26,high,Interview and whose.
1059,1059,2024-10-02,high,Finally make student relate agree.
1060,1060,2025-04-09,high,Hand drug series collection.
1061,1061,2024-01-28,medium,Season doctor various through heart data development.
1062,1062,2023-12-09,medium,Black every in consumer around mouth.
1063,1063,2023-07-07,medium,Book coach read perhaps cultural page number.
1064,1064,2023-09-09,medium,Decision response factor you.
1065,1065,2024-03-03,high,Good game avoid positive relate.
1066,1066,2024-05-06,high,Series region health for career sea benefit.
1067,1067,2023-10-11,high,Yourself father ground develop wide scientist door there.
1068,1068,2025-04-05,low,Report impact join fine technology almost remain.
1069,1069,2023-12-30,medium,Class woman room room financial.
1070,1070,2024-04-18,medium,Relate sense listen show garden stuff morning.
1071,1071,2024-09-15,medium,Your hour bill suddenly poor simply machine.
1072,1072,2024-05-01,high,Set owner mouth style family.
1073,1073,2024-04-17,medium,Avoid decade girl again reflect.
1074,1074,2023-09-17,medium,Her war cell direction attention structure.
1075,1075,2025-01-24,medium,Three our air push.
1076,1076,2025-02-20,medium,Remember open available.
1077,1077,2023-07-14,high,Oil drive all country ask scientist.
1078,1078,2023-08-26,high,Break use health attack meet special including.
1079,1079,2024-01-10,low,Push radio human ability create during.
1080,1080,2024-06-09,high,New head strong cause.
1081,1081,2024-04-14,high,Truth military able officer whole term.
1082,1082,2023-09-27,high,Camera mind as.
1083,1083,2023-10-05,low,Law against hot more deep.
1084,1084,2023-05-29,medium,Trade second so teacher head.
1085,1085,2024-06-14,medium,Cell give keep though sit push.
1086,1086,2024-04-27,high,Onto some begin fund.
1087,1087,2024-06-20,medium,Program light care treat stock plan.
1088,1088,2023-12-15,low,Almost ten article.
1089,1089,2023-09-28,medium,Inside that forward character leave hotel power.
1090,1090,2024-10-18,medium,Cold see crime will.
1091,1091,2023-06-23,medium,Sing fire interview leader focus pattern investment.
1092,1092,2023-12-28,low,Rich body standard star country they either.
1093,1093,2024-04-22,low,Suffer society condition set outside although claim bit.
1094,1094,2023-09-04,low,Design hear table treat effect itself church.
1095,1095,2024-11-19,low,Author degree customer employee.
1096,1096,2024-05-27,high,Item air social begin for opportunity information.
1097,1097,2024-05-03,medium,Maintain something cultural share.
1098,1098,2024-03-04,medium,That worry area plan lay.
1099,1099,2023-09-15,low,Article find structure go.
1100,1100,2024-06-16,medium,Movement executive method.
1101,1101,2023-10-12,low,Bring door could both party.
1102,1102,2024-02-22,low,Court manage mind soldier.
1103,1103,2024-06-13,high,Modern understand effect.
1104,1104,2024-11-28,medium,Apply happy head church everybody case growth.
1105,1105,2024-12-25,medium,Court very community shake.
1106,1106,2023-11-04,medium,Appear plant fund act school talk against.
1107,1107,2024-12-13,low,Administration dog room rock nothing eat break.
1108,1108,2023-11-26,medium,Over subject game major often.
1109,1109,2024-12-04,medium,Always form price I model center newspaper.
1110,1110,2024-10-01,low,Final agent activity include child reveal.
1111,1111,2023-05-01,low,Building arrive raise green easy.
1112,1112,2024-03-22,medium,Page them red same develop.
1113,1113,2023-11-03,low,Vote high player raise.
1114,1114,2024-01-19,low,Continue sell so practice future.
1115,1115,2023-11-21,medium,Pull culture interesting whatever less.
1116,1116,2023-06-22,high,Tax however back view space point form mean.
1117,1117,2024-08-24,high,Act she rule.
1118,1118,2024-10-29,medium,Prevent enter meeting husband source subject.
1119,1119,2023-08-16,low,Support national sense would open entire.
1120,1120,2024-08-11,high,Campaign civil light try anything listen.
1121,1121,2023-12-16,medium,Hand ahead find yeah kind trip evening.
1122,1122,2025-04-07,low,Admit instead despite performance black.
1123,1123,2025-03-10,medium,Spring point response too prevent its week.
1124,1124,2023-09-24,medium,Sense again such appear issue company.
1125,1125,2023-12-08,high,Let specific audience deep.
1126,1126,2024-12-03,low,Top actually cup strong.
1127,1127,2024-05-25,low,Key state able yes.
1128,1128,2024-08-19,medium,Record themselves brother field certain.
1129,1129,2024-07-26,low,These two green citizen ten field.
1130,1130,2023-06-26,medium,Treatment similar suffer.
1131,1131,2024-09-02,high,Mother friend involve network without enjoy.
1132,1132,2023-10-08,medium,Prevent collection trial increase its.
1133,1133,2023-04-27,medium,Song beautiful least sit lot term imagine your.
1134,1134,2024-07-11,medium,Somebody west name effect above option listen thing.
1135,1135,2024-03-02,medium,Possible country into seven.
1136,1136,2025-01-29,low,Between concern along place.
1137,1137,2024-04-18,medium,Per security employee.
1138,1138,2024-04-30,low,No visit out each.
1139,1139,2023-11-22,high,Wall drive economy society hour five.
1140,1140,2024-04-21,low,Laugh box within blood off sit performance.
1141,1141,2024-10-14,medium,Team teacher tax build.
1142,1142,2024-02-16,high,Trouble wait various up a.
1143,1143,2025-04-10,medium,Artist institution development box one.
1144,1144,2024-09-06,high,Trouble daughter material cold service war test second.
1145,1145,2025-03-03,high,Really form couple seem.
1146,1146,2025-03-31,high,Forget however close national send.
1147,1147,2024-01-31,medium,Professor try either source.
1148,1148,2024-07-17,medium,Land break community candidate subject production person its.
1149,1149,2023-07-30,medium,Foot lawyer describe color large.
1150,1150,2023-10-28,low,Entire money bank.
1151,1151,2024-08-10,medium,Available clear watch very begin success trouble.
1152,1152,2024-02-23,medium,Sport ball others board surface wind spend.
1153,1153,2024-01-16,medium,Soon close oil.
1154,1154,2025-01-04,high,Visit writer perform.
1155,1155,2024-11-29,medium,Far system cause have sister explain market.
1156,1156,2023-09-20,high,Better test by method anything go.
1157,1157,2025-03-04,high,May central life bank because.
1158,1158,2023-10-07,low,Cup economic election give.
1159,1159,2025-01-16,medium,Still employee stuff talk way.
1160,1160,2024-06-26,high,Bill house by house notice increase push.
1161,1161,2023-07-17,high,It west while manage black.
1162,1162,2023-08-18,medium,Similar hour foreign summer.
1163,1163,2024-01-21,medium,Can in eye medical professional moment true.
1164,1164,2024-08-09,medium,Ten court hit maintain employee nature source.
1165,1165,2024-03-27,low,Add among college property gun.
1166,1166,2023-08-08,high,Sometimes and bring plant respond exactly.
1167,1167,2025-02-04,medium,Rich enough foot political have those hotel difference.
1168,1168,2024-01-17,low,Poor black shake where agent one.
1169,1169,2025-02-28,high,If college drop.
1170,1170,2023-10-10,medium,Follow into into parent red never gun.
1171,1171,2024-11-19,low,Big tonight attorney.
1172,1172,2023-08-11,high,About plan evidence since security game we provide.
1173,1173,2024-06-16,low,Late oil approach.
1174,1174,2024-08-20,medium,Task push most.
1175,1175,2023-09-02,medium,Top any however create.
1176,1176,2024-07-24,medium,When society consumer.
1177,1177,2024-05-08,medium,Production task treat hotel same suddenly.
1178,1178,2024-11-28,medium,Against someone present.
1179,1179,2024-07-03,low,Person many or step claim more many.
1180,1180,2023-08-20,medium,Likely character leave often north there.
1181,1181,2025-04-02,high,Commercial local indicate traditional.
1182,1182,2023-12-05,low,Against onto morning wrong order process.
1183,1183,2024-09-18,medium,Rest eat charge pattern director.
1184,1184,2024-02-14,low,Again community policy fear answer cover.
1185,1185,2024-01-21,low,Inside pick national art view pay.
1186,1186,2023-09-04,medium,Drop week magazine whose something small sea.
1187,1187,2024-04-07,low,Fight knowledge happen.
1188,1188,2023-07-30,low,Improve bill tonight Democrat defense.
1189,1189,2023-06-05,medium,Board view ok treatment.
1190,1190,2023-11-03,low,Stock word street lot development.
1191,1191,2024-03-15,medium,Room fine item thank leader brother father.
1192,1192,2024-04-04,low,Reduce create recognize degree environmental know American.
1193,1193,2024-09-21,high,Lose perhaps air health difference whole why.
1194,1194,2023-08-08,low,Security can issue produce size father father finally.
1195,1195,2024-11-24,low,Usually wife food rule choice record.
1196,1196,2024-02-27,medium,Answer series end true ball offer religious.
1197,1197,2023-06-15,medium,Above ready minute lawyer.
1198,1198,2023-06-28,medium,Focus interesting degree around generation second top staff.
1199,1199,2025-03-09,high,Accept light few collection television enjoy.
1200,1200,2025-03-30,low,Beat decade former she.
1201,1201,2023-12-31,medium,Sort firm section phone.
1202,1202,2023-10-24,high,Difficult college unit audience base ability leg everyone.
1203,1203,2024-02-22,low,Identify song weight draw.
1204,1204,2023-07-10,medium,Five moment live finally teacher design respond.
1205,1205,2023-06-12,low,Matter even nearly little mean student.
1206,1206,2023-09-14,medium,Fall together environment raise arrive report century.
1207,1207,2023-06-26,medium,Decide night hope child federal fast.
1208,1208,2023-09-05,low,Until lawyer cultural my commercial.
1209,1209,2023-11-27,low,May part memory their government.
1210,1210,2024-05-05,medium,If network among sport analysis whole somebody present.
1211,1211,2024-06-05,medium,Fire source produce age.
1212,1212,2023-10-15,high,Energy situation last perform over game.
1213,1213,2025-02-27,low,During deep unit travel sort present.
1214,1214,2024-02-10,high,Outside newspaper recent hot likely federal.
1215,1215,2024-12-11,high,Which of crime kitchen street.
1216,1216,2023-05-16,low,Four shoulder source.
1217,1217,2024-10-10,low,Charge piece nature network.
1218,1218,2024-03-26,medium,Blue five mother already despite represent science.
1219,1219,2024-10-01,medium,Director stop interview today that play.
1220,1220,2023-06-26,medium,Affect report else politics move white.
1221,1221,2024-02-20,medium,Board trouble wide.
1222,1222,2023-05-25,low,Memory leader increase use tell.
1223,1223,2023-11-02,medium,Appear college loss knowledge speak when difference.
1224,1224,2024-12-09,high,Between image one likely skin Democrat.
1225,1225,2025-03-26,high,Its physical mother step house.
1226,1226,2024-01-15,low,Truth bring result site.
1227,1227,2023-08-21,high,Make interesting participant child remember others.
1228,1228,2023-09-02,medium,Remain seem way baby agent ten.
1229,1229,2024-03-26,medium,Before say agent idea.
1230,1230,2024-06-22,high,Itself kitchen game.
1231,1231,2024-03-19,low,Those summer baby memory.
1232,1232,2024-01-12,high,Sound three above high ground she.
1233,1233,2024-03-02,high,Project green value quite nothing these study.
1234,1234,2025-02-06,high,Marriage school outside style sort mention air.
1235,1235,2025-01-25,high,Artist agency dark.
1236,1236,2024-04-27,medium,Now state market former attorney job more go.
1237,1237,2023-06-14,low,Our share not suggest.
1238,1238,2024-06-09,low,Necessary security administration special culture hit.
1239,1239,2024-02-25,low,Heavy detail tax a charge start.
1240,1240,2023-10-10,medium,His bar very garden rest.
1241,1241,2023-06-16,high,Campaign skin many land commercial something affect.
1242,1242,2023-12-10,high,Argue statement teach.
1243,1243,2025-02-03,high,Oil yourself understand center parent.
1244,1244,2025-04-05,medium,They fall imagine address hand then act.
1245,1245,2024-11-18,high,Political soon total two relate senior machine.
1246,1246,2025-02-22,low,Allow director major against project administration half.
1247,1247,2025-04-07,high,Modern before score prepare cause.
1248,1248,2025-04-22,low,Would professional increase foot perhaps.
1249,1249,2023-11-19,low,Job day wrong.
1250,1250,2024-11-22,low,Threat hit while sign.
1251,1251,2024-04-22,low,Treat growth measure.
1252,1252,2024-04-25,medium,Which such throw.
1253,1253,2023-06-03,high,Customer side really both friend crime which.
1254,1254,2023-08-14,high,Finish reveal pass.
1255,1255,2024-05-31,medium,Service side computer.
1256,1256,2024-03-24,low,Condition knowledge start know standard.
1257,1257,2023-12-22,low,Player effect parent series suffer center as.
1258,1258,2023-09-05,high,Soldier president finally just in.
1259,1259,2024-01-17,low,Realize at prove a could meeting though.
1260,1260,2023-10-29,medium,Soon popular accept see agency list but.
1261,1261,2024-06-18,medium,Day election factor deal matter kid student.
1262,1262,2024-03-18,high,Almost computer benefit before dog.
1263,1263,2023-06-19,high,Idea determine center even.
1264,1264,2024-01-29,high,Occur relate responsibility tax improve owner.
1265,1265,2023-09-03,low,Service baby recognize human.
1266,1266,2024-12-23,low,Traditional the us radio because.
1267,1267,2024-09-20,low,Together dream push.
