interest_id,customer_id,survey_date,interest_level,comments
1677,1677,2023-04-27,medium,Field trouble quite field.
1678,1678,2023-07-31,high,Marriage tree product continue she remain.
1679,1679,2023-10-27,high,Oil occur interview many serve which media.
1680,1680,2023-08-19,medium,Activity seem but she over most.
1681,1681,2025-01-27,medium,Finally of maintain couple.
1682,1682,2024-10-27,low,Big laugh pick two stop.
1683,1683,2024-07-01,high,For create especially speak ball hand.
1684,1684,2024-05-26,high,Room country international opportunity.
1685,1685,2024-05-04,low,Audience seven stay task.
1686,1686,2023-06-05,low,Fund white film heavy south.
1687,1687,2024-05-31,high,Evidence before mother price sometimes.
1688,1688,2023-07-08,low,Business daughter remain job.
1689,1689,2023-08-21,high,Foot form manage late.
1690,1690,2024-09-17,high,Prepare network he stock somebody.
1691,1691,2023-05-08,low,Read himself page sense.
1692,1692,2024-12-02,low,Center customer vote range consumer fast.
1693,1693,2023-06-12,low,Challenge your identify rock entire will.
1694,1694,2025-01-07,low,Campaign personal chance under long let can.
1695,1695,2024-01-23,medium,Usually station become first forward interest.
1696,1696,2023-10-11,high,Gun give work continue tree.
1697,1697,2023-10-05,low,Wish doctor often staff responsibility growth something.
1698,1698,2024-10-10,high,Discuss itself check five interesting bank unit.
1699,1699,2023-08-30,high,Reality sing share impact.
1700,1700,2023-05-20,high,Write but executive teach skin yet bring.
1701,1701,2025-03-07,high,Page hear education hope.
1702,1702,2024-11-15,medium,Public speak while eat.
1703,1703,2023-06-20,low,Bit deep imagine hundred guy.
1704,1704,2024-05-17,high,Fine human low program here.
1705,1705,2024-07-14,low,Line authority debate table hotel say.
1706,1706,2023-10-08,low,Near conference song it tell wide.
1707,1707,2024-01-09,high,Form actually impact dream kitchen coach.
1708,1708,2023-05-21,high,Lot various eight home series.
1709,1709,2023-10-12,low,Institution blue walk data already human.
1710,1710,2023-07-17,low,Full try space.
1711,1711,2025-03-15,low,Ever meet Mr.
1712,1712,2024-12-09,medium,I station section know together believe.
1713,1713,2024-02-15,high,Special open PM teacher begin collection.
1714,1714,2025-01-07,low,Left across professional mouth.
1715,1715,2025-02-06,high,In such everyone thus whatever.
1716,1716,2024-01-13,medium,Whole would gun own.
1717,1717,2023-06-19,high,Arm meet task choose black.
1718,1718,2025-01-15,low,Remain two force establish film region experience.
1719,1719,2025-03-25,high,Maybe in detail project.
1720,1720,2024-08-04,high,Air eight car smile window brother support.
1721,1721,2023-06-16,low,Place picture street card pick.
1722,1722,2024-01-29,low,Model by woman customer job out fund.
1723,1723,2024-01-28,high,Military the two.
1724,1724,2025-02-06,high,Make everything deal break middle control.
1725,1725,2025-03-09,medium,Strong option when bar mission meet.
1726,1726,2023-07-05,low,Whom reach those.
1727,1727,2024-06-20,medium,Message trial why popular economy board.
1728,1728,2024-04-20,medium,People into involve drop turn down.
1729,1729,2024-08-29,medium,Rise area medical operation.
1730,1730,2024-09-15,medium,Compare science game.
1731,1731,2023-07-18,low,Them mean than watch court add relationship team.
1732,1732,2024-08-20,high,Usually once security toward person stage medical.
1733,1733,2023-12-07,medium,Final amount low agree price only.
1734,1734,2025-02-08,medium,Son forward almost them official image happen reach.
1735,1735,2025-02-11,high,Religious at father investment.
1736,1736,2023-12-06,medium,Meeting less study hundred who answer.
1737,1737,2024-12-06,low,Test simple she child his.
1738,1738,2024-04-11,low,Sea with by building war.
1739,1739,2023-12-01,medium,Hour star window be attack claim.
1740,1740,2024-11-21,high,Certain easy close some raise employee cover.
1741,1741,2024-08-29,medium,In attention success relationship effort boy receive.
1742,1742,2024-11-28,medium,Money cup space.
1743,1743,2024-09-15,medium,Chair example car current usually.
1744,1744,2023-11-03,medium,Ok factor where season may care.
1745,1745,2025-02-16,medium,Bed wife heart reality.
1746,1746,2024-01-03,medium,Long value cup only accept water.
1747,1747,2025-02-03,low,Gas middle top fly arrive.
1748,1748,2024-01-31,low,Station international skill.
1749,1749,2024-06-11,high,Chair guy want value animal.
1750,1750,2025-02-25,high,Above commercial who base too try.
1751,1751,2025-01-03,high,Age a between force answer affect start road.
1752,1752,2023-05-22,medium,Rise behind across culture factor political prepare price.
1753,1753,2024-02-05,low,Ten century wear approach almost low administration.
1754,1754,2023-09-18,high,Arrive off growth me responsibility claim.
1755,1755,2024-04-27,low,Police meeting human tax.
1756,1756,2024-05-29,low,Seek when performance high.
1757,1757,2024-09-03,medium,Foreign method memory week happy just.
1758,1758,2023-09-13,low,Suddenly you risk happen sure.
1759,1759,2023-12-27,medium,Nor maintain consider church car unit.
1760,1760,2024-05-02,high,Build according reduce.
1761,1761,2025-03-20,medium,Fear carry surface agreement.
1762,1762,2024-04-03,low,Them without argue drive ok ground.
1763,1763,2024-01-29,medium,Media stock writer animal.
1764,1764,2024-12-23,medium,Approach cover forward enter.
1765,1765,2025-03-03,high,Cause draw religious surface themselves.
1766,1766,2024-11-12,low,Mouth again difference never reality kitchen partner.
1767,1767,2024-05-25,low,Mr five style five.
1768,1768,2023-12-22,high,Your alone financial score.
1769,1769,2024-10-31,high,Easy behavior form identify section choice.
1770,1770,2024-07-19,medium,Box increase understand mission.
1771,1771,2024-06-21,low,Same fear important speech war within.
1772,1772,2023-10-12,low,Maintain necessary whatever employee program current.
1773,1773,2025-04-23,high,Create everyone authority its bring.
1774,1774,2023-06-21,high,Something sea sort resource man hit.
1775,1775,2024-10-13,medium,Later consumer detail fish in go true.
1776,1776,2023-07-18,high,Candidate easy before war home place short.
1777,1777,2023-07-21,medium,Own seem poor need.
1778,1778,2024-03-18,high,Once back scene traditional first.
1779,1779,2024-04-23,high,Market Mr growth mind unit prove but.
1780,1780,2024-12-01,high,American goal few difference rule position rich.
1781,1781,2025-04-18,medium,Do hundred first three doctor any.
1782,1782,2024-04-08,medium,Travel fight close try power.
1783,1783,2024-05-08,high,Wait former this.
1784,1784,2024-06-15,high,Role social it year four different.
1785,1785,2025-01-03,low,Suddenly reduce itself yourself evening tonight girl shoulder.
1786,1786,2024-10-02,medium,Your painting option individual live.
1787,1787,2024-01-04,low,Structure much direction relate look community why.
1788,1788,2024-03-30,low,Guy say usually receive sell improve.
1789,1789,2024-12-12,high,So paper present really such.
1790,1790,2023-11-16,high,Her civil magazine walk.
1791,1791,2023-12-16,medium,Everything such difference news arrive artist above.
1792,1792,2024-11-16,medium,Group president forget population few agree poor.
1793,1793,2024-11-24,low,After leave choose yourself difficult.
1794,1794,2024-10-03,high,Throughout over year near husband suggest.
1795,1795,2023-06-09,high,Follow yeah range game.
1796,1796,2025-02-24,high,Among appear over improve.
1797,1797,2023-09-04,medium,Public spring writer three whether about.
1798,1798,2024-08-15,medium,Past find budget line middle.
1799,1799,2024-05-02,medium,Next financial field tend mission meet yes.
1800,1800,2024-04-28,medium,Another interesting dinner.
1801,1801,2023-05-20,low,Increase now very look.
1802,1802,2024-08-10,low,Impact dream report card increase prove majority.
1803,1803,2023-06-08,low,Institution risk size show break.
1804,1804,2024-07-23,medium,Happen religious candidate quality likely age sea.
1805,1805,2023-12-17,low,Work wide happen area plan.
1806,1806,2024-06-23,high,Here during throw stuff use.
1807,1807,2024-09-25,medium,Because least environmental.
1808,1808,2024-05-07,low,Executive certain while strategy.
1809,1809,2023-05-03,medium,Officer campaign worry contain rest.
1810,1810,2023-05-18,low,Season performance ready.
1811,1811,2024-01-08,low,Deep news reason market take.
1812,1812,2023-09-15,high,Perhaps relate car should.
1813,1813,2025-02-18,low,Coach air stage family around drop also.
1814,1814,2024-02-04,high,Offer kid central include world.
1815,1815,2024-04-22,medium,Window environmental name camera sometimes practice everybody.
1816,1816,2023-07-02,high,Town less address be nation reveal prevent.
1817,1817,2024-12-23,medium,Range chair mission deal.
1818,1818,2024-02-09,low,Leg left somebody every student social professional.
1819,1819,2023-07-26,medium,Those about necessary career.
1820,1820,2024-07-20,high,Three loss hit.
1821,1821,2025-03-02,medium,Force somebody environment it finally he.
1822,1822,2024-09-22,medium,Maintain necessary low subject yes face particular.
1823,1823,2025-04-18,medium,View light son positive know side follow.
1824,1824,2024-11-22,low,Record laugh least study but.
1825,1825,2023-11-26,medium,Nature traditional use film.
1826,1826,2024-04-13,high,Place base nice cover.
1827,1827,2024-12-23,medium,Whom up upon third court.
1828,1828,2023-10-20,medium,President democratic bar entire information attack through.
1829,1829,2024-07-03,low,End organization interest thousand particularly arm talk.
1830,1830,2023-09-29,medium,Address claim visit speech forget provide.
1831,1831,2023-05-01,low,As this local.
1832,1832,2024-01-10,low,Protect offer line.
1833,1833,2023-06-18,low,Nice might know church.
1834,1834,2024-03-01,medium,View high great.
1835,1835,2025-03-11,high,Care natural season though floor nature than.
1836,1836,2023-06-09,low,Week carry property quickly hot.
1837,1837,2024-12-21,high,Owner current free study court community.
1838,1838,2023-10-01,medium,Agree team choose administration to possible style.
1839,1839,2024-08-29,high,After back now group ten case discover.
1840,1840,2023-06-26,medium,Republican rise business air and.
1841,1841,2023-09-14,high,Certain guess course also.
1842,1842,2024-08-16,medium,Our middle trip.
1843,1843,2023-12-24,medium,Station window mouth sell production peace feeling situation.
1844,1844,2024-04-27,medium,Now will interview support south.
1845,1845,2024-07-18,high,Data adult for probably necessary generation.
1846,1846,2024-10-08,low,Summer stock pull technology order.
1847,1847,2025-03-04,low,Mean technology local inside treatment fund travel.
1848,1848,2024-05-20,low,Religious expect interview institution leader manage.
1849,1849,2025-04-12,medium,Rather rich commercial capital student.
1850,1850,2023-12-27,low,Measure often conference since however represent accept.
1851,1851,2023-10-22,high,Measure two single receive century son authority.
1852,1852,2024-12-22,high,Church suggest customer produce area hour share indicate.
1853,1853,2024-06-03,low,Guy just watch idea my glass woman.
1854,1854,2023-12-14,low,Production art arrive become special effort scientist event.
1855,1855,2024-06-25,medium,Office officer draw one production trade.
1856,1856,2025-04-15,medium,Despite approach try president something mention seem which.
1857,1857,2023-06-23,high,Official small woman mind.
1858,1858,2024-03-30,medium,Wall when glass floor the next.
1859,1859,2023-05-07,low,Actually art money past hour box season bring.
1860,1860,2024-02-23,high,Certainly save sound include program explain.
1861,1861,2023-10-27,medium,Environmental west role whole hospital fine step future.
1862,1862,2024-12-06,low,Gun anything piece foot just.
1863,1863,2023-09-01,low,Nice democratic major interesting technology job.
1864,1864,2023-10-31,low,Realize every this science suffer by live weight.
1865,1865,2025-01-10,medium,Most Congress indicate up no second.
1866,1866,2024-04-02,medium,Fear edge school behind.
1867,1867,2025-02-15,high,History edge front likely writer name guy.
1868,1868,2023-10-09,low,Represent concern toward brother inside issue trial.
1869,1869,2023-09-19,low,Role never condition system.
1870,1870,2025-01-26,low,Record bag them great the.
1871,1871,2024-02-24,medium,Within trade might budget prove.
1872,1872,2023-07-30,medium,Attention hear simply.
1873,1873,2023-10-13,low,Rest chair general voice world require task.
1874,1874,2025-04-13,high,General hold dream everyone doctor north.
1875,1875,2024-07-28,medium,Window include focus whose data.
1876,1876,2024-12-10,high,Small movement he try.
1877,1877,2023-06-10,medium,Decision girl check medical computer east.
1878,1878,2023-08-25,medium,Tell hope tax word prove north different.
1879,1879,2024-08-24,low,Two probably goal series want some look.
1880,1880,2024-02-02,medium,Commercial reason door role computer.
1881,1881,2023-08-04,high,Rise by whose yard by.
1882,1882,2024-07-13,medium,Call body customer chance education open same.
1883,1883,2024-01-27,high,Phone sit one very by relate.
1884,1884,2025-02-25,high,One six data region hot never doctor.
1885,1885,2024-04-06,medium,Middle picture act career.
1886,1886,2024-11-13,medium,Rock a include month certainly sometimes film.
1887,1887,2024-07-09,high,Why all perhaps maintain chair.
1888,1888,2025-04-02,high,Say age political.
1889,1889,2025-01-27,low,Add TV which store political crime.
1890,1890,2024-11-30,low,Writer responsibility but thousand.
1891,1891,2023-08-03,low,Way performance mission base.
1892,1892,2024-07-03,low,Head media plant last far.
1893,1893,2024-04-11,medium,Doctor increase score nearly sea ok bar whole.
1894,1894,2024-05-01,high,Son base green upon.
1895,1895,2023-07-15,low,Prevent along each learn news sense.
1896,1896,2024-01-10,medium,Check environmental kitchen ball during professional.
1897,1897,2024-04-26,low,Might image two without development need window set.
1898,1898,2024-01-30,high,Finish describe conference data military.
1899,1899,2025-01-29,low,Base general question.
1900,1900,2024-03-21,high,Meet others reach yourself.
1901,1901,2024-07-25,medium,List us person when team sign.
1902,1902,2024-08-01,high,International eye start wrong reason.
1903,1903,2025-04-01,low,Represent past who rise to.
1904,1904,2024-05-08,medium,Until study manage.
1905,1905,2024-03-08,low,Born father smile stock paper so.
1906,1906,2023-08-31,high,Cultural top actually thousand.
1907,1907,2024-09-16,medium,Treat interview onto employee per name break.
1908,1908,2023-05-20,medium,People mention realize especially.
1909,1909,2025-03-24,low,Industry value movie certainly protect summer Republican.
1910,1910,2023-05-02,low,Building prove ball wife rock white couple.
1911,1911,2023-06-18,low,Together lay modern try whatever.
1912,1912,2023-06-10,medium,Result soon together technology.
1913,1913,2024-10-19,medium,Interest detail crime health your official attack police.
1914,1914,2024-09-16,low,Full party trade operation staff.
1915,1915,2024-11-21,medium,Guy either bring seat month understand capital offer.
1916,1916,2024-02-20,medium,Young care keep art blood hot mind.
1917,1917,2024-08-18,high,Attention almost others theory.
1918,1918,2024-12-18,medium,Across when office civil if upon become important.
1919,1919,2023-11-08,high,Parent almost become under.
1920,1920,2025-02-21,low,Deal theory reality color great give.
1921,1921,2024-04-21,medium,Too site politics including ground environmental.
1922,1922,2023-12-08,low,Section test end.
1923,1923,2023-12-19,low,Collection decade event animal teacher.
1924,1924,2024-07-20,high,One all support weight give condition Mrs.
1925,1925,2025-01-16,medium,Up sit police evening beat you.
1926,1926,2024-09-19,low,She edge detail democratic full approach.
1927,1927,2024-03-24,high,Finish fire west politics prevent court.
1928,1928,2024-11-28,medium,Know firm hand land after poor.
1929,1929,2024-02-29,high,Thank view accept fast husband.
1930,1930,2024-09-01,high,Laugh ten base.
1931,1931,2025-02-25,medium,Talk someone identify maybe.
1932,1932,2025-04-05,low,Realize impact board leg require.
1933,1933,2024-03-12,low,Recent scientist agent brother set.
1934,1934,2023-08-26,medium,News we whose father surface newspaper option.
1935,1935,2024-04-01,high,Hope four sometimes good rest think wife arm.
1936,1936,2024-12-21,medium,Consumer trip among before practice last.
1937,1937,2023-05-04,low,By his prove away challenge could everybody.
1938,1938,2023-11-20,medium,Sort newspaper strong officer total at training both.
1939,1939,2025-03-30,medium,Floor drug contain fear.
1940,1940,2024-08-28,high,Child together rather million amount.
1941,1941,2024-06-18,low,Kind people work while true us.
1942,1942,2024-12-06,medium,Vote he take them ago page impact.
1943,1943,2025-01-20,high,Pay attention give.
1944,1944,2023-12-22,low,Turn final across nature eat.
1945,1945,2023-06-14,low,Little ground light perhaps role local.
1946,1946,2023-12-19,low,Until remain concern visit clearly with.
1947,1947,2025-01-31,high,May nature these available floor usually wall.
1948,1948,2024-11-30,high,Carry by glass say cost arm great.
1949,1949,2025-01-31,low,Old station deep receive article.
1950,1950,2024-10-22,high,Again south adult energy war make.
1951,1951,2023-07-13,medium,Office teach bank response she manage any.
1952,1952,2024-10-12,high,Trial grow various industry.
1953,1953,2023-12-17,high,Style if turn.
1954,1954,2024-01-04,medium,Run table government parent tree seat cold.
1955,1955,2024-09-21,medium,Challenge marriage couple with.
1956,1956,2023-10-26,medium,Necessary learn open hotel option he.
1957,1957,2024-06-04,medium,Star among even control pick sound stay.
1958,1958,2023-07-18,medium,Black guy return.
1959,1959,2024-03-08,medium,Hotel fine record total political may.
1960,1960,2023-11-23,low,Skin none light writer relate.
1961,1961,2023-11-24,high,Want use old value short yes under manage.
1962,1962,2024-02-07,high,Talk family author discussion.
1963,1963,2023-05-18,high,Strategy international energy cup marriage thought onto.
1964,1964,2024-11-07,high,Clear growth unit exist popular.
1965,1965,2023-06-12,medium,Back simply alone player note former on.
1966,1966,2024-07-17,high,Type answer something with need get.
1967,1967,2023-07-20,low,Arm put model spend figure keep brother would.
1968,1968,2023-12-03,medium,Which factor up inside why drop local.
1969,1969,2024-12-07,high,Enjoy performance pattern why myself allow during.
1970,1970,2023-06-28,high,Perhaps institution first build instead charge thousand.
1971,1971,2023-07-13,high,Bank member population sport international.
1972,1972,2025-01-02,medium,Fight way job tonight land discover professional.
1973,1973,2023-06-09,medium,Only defense recent.
1974,1974,2023-10-03,low,Offer there much conference rich specific.
1975,1975,2023-12-26,low,Discussion space current attack start industry present.
1976,1976,2024-08-29,high,Church yes establish get book.
1977,1977,2024-01-10,high,Success police able free.
1978,1978,2025-01-17,medium,Beat performance edge best third Democrat agency amount.
1979,1979,2023-05-15,high,Increase church wall market explain fund.
1980,1980,2023-06-08,high,Military indeed as us.
1981,1981,2024-01-15,low,Save young simply education city of.
1982,1982,2024-02-21,high,Social control return up produce different enjoy.
1983,1983,2023-10-28,high,Shake time president goal movement foreign.
1984,1984,2024-06-20,low,Feel crime add employee country their social.
1985,1985,2023-09-01,low,Several none quickly bill yourself reach five.
1986,1986,2023-12-12,low,Usually use course single energy from include.
1987,1987,2025-04-15,low,Sea almost change full.
1988,1988,2024-08-24,medium,Avoid my many wait.
1989,1989,2024-10-20,high,Ever face risk follow consider wear final.
1990,1990,2023-05-06,medium,Pull hard four between.
1991,1991,2023-05-02,high,Improve choose subject.
1992,1992,2023-07-14,medium,Behavior boy operation.
1993,1993,2023-10-03,high,News scientist natural it factor.
1994,1994,2023-09-16,low,Two keep focus perhaps likely career itself.
1995,1995,2024-05-24,high,Catch happy beautiful beyond prevent green.
1996,1996,2023-12-16,medium,Reflect team activity member concern would wish such.
1997,1997,2023-06-24,medium,Window action specific.
1998,1998,2023-09-10,high,Fear central attack account.
1999,1999,2024-10-20,high,Benefit tax despite dream.
2000,2000,2024-07-05,high,To various color.
2001,2001,2024-09-13,medium,State national professor today tell probably economy.
2002,2002,2023-06-02,high,Sell race expect student try.
2003,2003,2023-10-15,high,Difficult compare performance southern in senior spend use.
2004,2004,2023-11-13,medium,Project partner anyone administration him analysis.
2005,2005,2024-05-02,high,Low deep second.
2006,2006,2023-11-08,medium,Animal later expect off.
2007,2007,2024-05-23,medium,Card successful responsibility management yet.
2008,2008,2024-01-22,high,High quite manager human dinner.
2009,2009,2023-05-15,high,Take lead manager kind fly.
2010,2010,2023-11-10,medium,Training water forget today.
2011,2011,2023-07-08,medium,Type job simple long run response recently.
2012,2012,2025-02-15,low,Against western give admit image very identify.
2013,2013,2024-12-06,low,Age management lot inside she reveal summer.
2014,2014,2024-11-20,low,Animal according group prevent same wide often.
2015,2015,2023-12-01,medium,Range service court study.
2016,2016,2024-12-18,high,Through north organization baby moment war ground.
2017,2017,2023-12-17,medium,Conference group gun soon age hair.
2018,2018,2024-07-11,low,Class woman might environment fast since organization rise.
2019,2019,2025-02-08,medium,Operation cost go election president pass.
2020,2020,2024-08-25,high,Exist everything operation word energy call.
2021,2021,2023-08-30,low,Onto magazine tell but small he house measure.
2022,2022,2024-03-13,high,Second interview fill consumer action democratic.
2023,2023,2024-01-24,high,Girl house ok vote.
2024,2024,2024-07-06,medium,Hair class actually later break near nation.
2025,2025,2024-10-06,high,Must affect choose TV car.
2026,2026,2024-06-09,low,Thank least including.
2027,2027,2024-12-19,high,Drop order tend.
2028,2028,2024-10-08,low,More standard poor less fish front.
2029,2029,2024-08-26,medium,Small coach increase add think television.
2030,2030,2024-06-05,low,Attention military build hour assume.
2031,2031,2024-10-26,low,Traditional reason seek become summer take.
2032,2032,2023-09-29,medium,Federal doctor finish tax southern would.
2033,2033,2025-03-26,medium,Off represent production suggest compare police thus.
2034,2034,2024-12-06,high,Several skin meet movie law.
2035,2035,2024-08-12,low,War most play.
2036,2036,2024-11-11,medium,Unit development item support coach.
2037,2037,2024-02-03,high,Shake put wrong thing time reason reason.
2038,2038,2023-11-21,low,Hotel measure support pressure decide behind generation service.
2039,2039,2024-03-04,high,Reach mission table do.
2040,2040,2024-07-30,low,Question somebody student large suggest.
2041,2041,2024-11-17,high,Lot national partner enough option lot protect.
2042,2042,2025-03-08,low,Create service even everybody laugh politics write whose.
2043,2043,2023-07-06,medium,Here over measure sister boy clearly.
2044,2044,2024-12-13,high,Report turn account yard class point.
2045,2045,2024-08-22,medium,Door from provide piece skill.
2046,2046,2024-05-31,medium,State world three listen offer day unit page.
2047,2047,2023-06-16,high,Family plant three total item.
2048,2048,2024-12-29,low,Writer want executive American among key.
2049,2049,2023-12-15,medium,Few program suggest finish total former.
2050,2050,2023-07-23,high,Low you truth former thought check.
2051,2051,2023-12-15,low,Certain must interest knowledge what.
2052,2052,2023-10-26,high,Oil practice view seven cold benefit.
2053,2053,2023-12-03,low,Add really pattern feeling.
2054,2054,2024-09-06,low,You subject good.
2055,2055,2023-08-18,medium,Write program into increase full.
2056,2056,2024-03-13,medium,Officer how agency indicate write.
2057,2057,2024-01-25,low,Join occur artist wonder.
2058,2058,2025-02-17,high,Three sometimes those follow.
2059,2059,2023-08-23,low,Pattern cut cost enjoy than of.
2060,2060,2023-08-12,low,Notice throughout increase nothing usually.
2061,2061,2024-10-21,low,Myself eat attack order ability image.
2062,2062,2024-12-24,high,Television picture opportunity their anything while.
2063,2063,2024-10-31,high,Mission fly claim Mrs discuss happen could trip.
2064,2064,2024-08-29,low,Nation add later skill travel kind TV indeed.
2065,2065,2024-09-20,high,Write soldier concern physical court single recently way.
2066,2066,2024-02-27,low,Suddenly seek as plant yourself cover.
2067,2067,2024-09-12,medium,Table personal money option.
2068,2068,2023-12-26,medium,Participant employee better develop eight campaign.
2069,2069,2024-05-22,low,Away behind last main.
2070,2070,2023-05-30,medium,Clearly east understand then respond partner throughout read.
2071,2071,2024-01-30,high,Two fly tax police while with.
2072,2072,2024-09-28,medium,Behavior guess reduce play.
2073,2073,2024-08-16,medium,Campaign not Republican less pressure pick.
2074,2074,2024-02-20,medium,Deal analysis report discuss population outside always.
2075,2075,2024-10-30,medium,Final later simple great.
2076,2076,2024-05-24,low,Southern production cause however country major.
2077,2077,2024-12-20,low,A we gas run sure general require mind.
2078,2078,2023-05-15,low,Information another gun.
2079,2079,2024-10-19,medium,Inside indeed per heavy choose sure.
2080,2080,2023-07-09,low,Single concern game.
2081,2081,2024-07-08,medium,His everything player federal.
2082,2082,2024-03-15,high,Send nearly energy race case member save.
2083,2083,2023-11-10,high,Bring Congress pick ability thing better.
2084,2084,2024-05-12,high,Like certain light prevent.
